Sort Index,Vocab-Japan,Vocab-Furigana,Vocab-English,audio file,Sent-Japan,Sent-Furigana,Sent-English,Vocab-Pitch,Vocab-POS,Note-Question side,Note-Answer side,Chapter,Section,Gener Sent
JLPT_Tango_N4_0237,ミーティング,ミーティング,meeting,[sound:JLPT_Tango_N4_0237.mp3],昼ごはんを食べながらミーティングをしましょう。,昼[ひる]ごはんを 食[た]べながらミーティングをしましょう。,Let's have a meeting while eating lunch.,,,,,Ch 02 - 勉強と仕事,Sect 04 - 仕事①,X
JLPT_Tango_N4_0237-005,ミーティングルーム,ミーティングルーム,meeting room,[sound:JLPT_Tango_N4_0237-005.mp3],,,,,,,Related meaning to ミーティング,Ch 02 - 勉強と仕事,Sect 04 - 仕事①,
JLPT_Tango_N4_0237-006,ミーティング中,ミーティング 中[ちゅう],in the middle of a meeting,[sound:JLPT_Tango_N4_0237-006.mp3],,,,,,,Related meaning to ミーティング,Ch 02 - 勉強と仕事,Sect 04 - 仕事①,
JLPT_Tango_N4_0238,意見,意見[いけん],opinion,[sound:JLPT_Tango_N4_0238.mp3],人の意見をよく聞きましょう。,人[ひと]の 意見[いけん]をよく 聞[き]きましょう。,Let's listen carefully to people's opinions.,,,,,Ch 02 - 勉強と仕事,Sect 04 - 仕事①,X
JLPT_Tango_N4_0239,アイディア,アイディア,idea,[sound:JLPT_Tango_N4_0239.mp3],部長のアイディアはおもしろいです。,部長[ぶちょう]のアイディアはおもしろいです。,The department chief's idea is interesting.,,,,,Ch 02 - 勉強と仕事,Sect 04 - 仕事①,X
JLPT_Tango_N4_0240,スケジュール,スケジュール,schedule,[sound:JLPT_Tango_N4_0240.mp3],社長のスケジュールを知っていますか。,社長[しゃちょう]のスケジュールを 知[し]っていますか。,Do you know the president's schedule?,,,,,Ch 02 - 勉強と仕事,Sect 04 - 仕事①,X
JLPT_Tango_N4_0241,出張＜する＞,出張[しゅっちょう]＜する＞,business trip,[sound:JLPT_Tango_N4_0241.mp3],父はよくアメリカへ出張しています。,父[ちち]はよくアメリカへ 出張[しゅっちょう]しています。,My father often goes to America on business trips.,,,,,Ch 02 - 勉強と仕事,Sect 04 - 仕事①,X
JLPT_Tango_N4_0242,もどる,もどる,"to return, to come back",[sound:JLPT_Tango_N4_0242.mp3],A「田中さんがもどるのは何時ですか。」<div>B「３時ごろだと思います。」</div>,A「 田中[たなか]さんがもどるのは 何[なん] 時[じ]ですか。」 <div>B「３ 時[じ]ごろだと 思[おも]います。」</div>,A: What time is Tanaka-san coming back?<div>B: I think around 3:00.</div>,,,,,Ch 02 - 勉強と仕事,Sect 04 - 仕事①,X
JLPT_Tango_N4_0243,もどす,もどす,"to return, to give back",[sound:JLPT_Tango_N4_0243.mp3],新聞を読んだら、ここにもどしてください。,新聞[しんぶん]を 読[よ]んだら、ここにもどしてください。,Please return the newspapers here after you read them.,,,,,Ch 02 - 勉強と仕事,Sect 04 - 仕事①,X
JLPT_Tango_N4_0244,本社,本社[ほんしゃ],main office,[sound:JLPT_Tango_N4_0244.mp3],春から東京の本社に行きます。,春[はる]から 東京[とうきょう]の 本社[ほんしゃ]に 行[い]きます。,I'm going to the main office in Tokyo starting in the spring.,,,,,Ch 02 - 勉強と仕事,Sect 04 - 仕事①,X
JLPT_Tango_N4_0244-005,支社,支社[ししゃ],branch office,[sound:JLPT_Tango_N4_0244-005.mp3],,,,,,,Related meaning to 本社,Ch 02 - 勉強と仕事,Sect 04 - 仕事①,
JLPT_Tango_N4_0244-006,本店,本店[ほんてん],main store,[sound:JLPT_Tango_N4_0244-006.mp3],,,,,,,Related meaning to 本社,Ch 02 - 勉強と仕事,Sect 04 - 仕事①,
JLPT_Tango_N4_0244-007,支店,支店[してん],branch store,[sound:JLPT_Tango_N4_0244-007.mp3],,,,,,,Related meaning to 本社,Ch 02 - 勉強と仕事,Sect 04 - 仕事①,
JLPT_Tango_N4_0245,社長,社長[しゃちょう],president,[sound:JLPT_Tango_N4_0245.mp3],私の会社の社長は若いですね。,私[わたし]の 会社[かいしゃ]の 社長[しゃちょう]は 若[わか]いですね。,The president of my company is young.,,,,,Ch 02 - 勉強と仕事,Sect 04 - 仕事①,X
JLPT_Tango_N4_0245-005,社長室,社長[しゃちょう] 室[しつ],president's office,[sound:JLPT_Tango_N4_0245-005.mp3],,,,,,,Related meaning to 社長,Ch 02 - 勉強と仕事,Sect 04 - 仕事①,
JLPT_Tango_N4_0245-006,部長,部長[ぶちょう],head of a department,[sound:JLPT_Tango_N4_0245-006.mp3],,,,,,,Related meaning to 社長,Ch 02 - 勉強と仕事,Sect 04 - 仕事①,
JLPT_Tango_N4_0245-007,課長,課長[かちょう],head of a section,[sound:JLPT_Tango_N4_0245-007.mp3],,,,,,,Related meaning to 社長,Ch 02 - 勉強と仕事,Sect 04 - 仕事①,
JLPT_Tango_N4_0246,ルール,ルール,rule,[sound:JLPT_Tango_N4_0246.mp3],会社のルールをよく読んでください。,会社[かいしゃ]のルールをよく 読[よ]んでください。,Please read the company rules carefully.,,,,,Ch 02 - 勉強と仕事,Sect 04 - 仕事①,X
JLPT_Tango_N4_0247,規則,規則[きそく],"rule, regulation",[sound:JLPT_Tango_N4_0247.mp3],この会社の規則を知っていますか。,この 会社[かいしゃ]の 規則[きそく]を 知[し]っていますか。,Do you know this company's rules and regulations?,,,,,Ch 02 - 勉強と仕事,Sect 04 - 仕事①,X
JLPT_Tango_N4_0247-005,校則,校則[こうそく],school regulation,[sound:JLPT_Tango_N4_0247-005.mp3],,,,,,,Related meaning to 規則,Ch 02 - 勉強と仕事,Sect 04 - 仕事①,
JLPT_Tango_N4_0248,決まる,決[き]まる,to be decided,[sound:JLPT_Tango_N4_0248.mp3],新しいアルバイトが決まりました。,新[あたら]しいアルバイトが 決[き]まりました。,My new part-time job has been decided.,,,,,Ch 02 - 勉強と仕事,Sect 04 - 仕事①,X
JLPT_Tango_N4_0249,決める,決[き]める,to decide,[sound:JLPT_Tango_N4_0249.mp3],会議の時間を決めましょう。,会議[かいぎ]の 時間[じかん]を 決[き]めましょう。,Let's decide the time of the meeting.,,,,,Ch 02 - 勉強と仕事,Sect 04 - 仕事①,X
JLPT_Tango_N4_0250,きょか＜する＞,きょか＜する＞,permission,[sound:JLPT_Tango_N4_0250.mp3],休むときはきょかをもらってください。,休[きゅう]むときはきょかをもらってください。,Please receive permission when you want to take time off.,,,,,Ch 02 - 勉強と仕事,Sect 04 - 仕事①,X
JLPT_Tango_N4_0251,（はんこを）押す,（はんこを） 押[お]す,to stamp (a seal),[sound:JLPT_Tango_N4_0251.mp3],ここにはんこを押してください。,ここにはんこを 押[お]してください。,Please stamp your seal here.,,,,,Ch 02 - 勉強と仕事,Sect 04 - 仕事①,X
JLPT_Tango_N4_0252,ちこく＜する＞,ちこく＜する＞,"to be late, being late",[sound:JLPT_Tango_N4_0252.mp3],１分でもちこくしてはいけません。,１分[いっぷん]でもちこくしてはいけません。,You mustn't be late by even one minute.,,,,,Ch 02 - 勉強と仕事,Sect 04 - 仕事①,X
JLPT_Tango_N4_0253,技術,技術[ぎじゅつ],technology,[sound:JLPT_Tango_N4_0253.mp3],この会社にはどんな技術がありますか。,この 会社[かいしゃ]にはどんな 技術[ぎじゅつ]がありますか。,What kind of technology does this company have?,,,,,Ch 02 - 勉強と仕事,Sect 05 - 仕事②,X
JLPT_Tango_N4_0254,パソコン,パソコン,computer,[sound:JLPT_Tango_N4_0254.mp3],パソコンを見ていると、目がつかれます。,パソコンを 見[み]ていると、 目[め]がつかれます。,"After staring at my computer, my eyes get tired.",,,,,Ch 02 - 勉強と仕事,Sect 05 - 仕事②,X
JLPT_Tango_N4_0255,ソフト,ソフト,software,[sound:JLPT_Tango_N4_0255.mp3],パソコンのソフトを作る仕事がしたいです。,パソコンのソフトを 作[つく]る 仕事[しごと]がしたいです。,I want to have a job where I make computer software.,,,,,Ch 02 - 勉強と仕事,Sect 05 - 仕事②,X
JLPT_Tango_N4_0255-005,ゲームソフト,ゲームソフト,game software,[sound:JLPT_Tango_N4_0255-005.mp3],,,,,,,Related meaning to ソフト,Ch 02 - 勉強と仕事,Sect 05 - 仕事②,
JLPT_Tango_N4_0256,書類,書類[しょるい],document,[sound:JLPT_Tango_N4_0256.mp3],明日までにこの書類を出してください。,明日[あす]までにこの 書類[しょるい]を 出[だ]してください。,Please submit these documents by tomorrow.,,,,,Ch 02 - 勉強と仕事,Sect 05 - 仕事②,X
JLPT_Tango_N4_0256-005,資料,資料[しりょう],materials,[sound:JLPT_Tango_N4_0256-005.mp3],,,,,,,Related meaning to 書類,Ch 02 - 勉強と仕事,Sect 05 - 仕事②,
JLPT_Tango_N4_0257,ファイル,ファイル,file,[sound:JLPT_Tango_N4_0257.mp3],資料をファイルに入れます。,資料[しりょう]をファイルに 入[い]れます。,I'm going to put these materials in the file.,,,,,Ch 02 - 勉強と仕事,Sect 05 - 仕事②,X
JLPT_Tango_N4_0258,入力＜する＞,入力[にゅうりょく]＜する＞,input,[sound:JLPT_Tango_N4_0258.mp3],ここに英語で入力してください。,ここに 英語[えいご]で 入力[にゅうりょく]してください。,Please input things here in English.,,,,,Ch 02 - 勉強と仕事,Sect 05 - 仕事②,X
JLPT_Tango_N4_0259,ほんやく＜する＞,ほんやく＜する＞,translation,[sound:JLPT_Tango_N4_0259.mp3],中国語を日本語にほんやくします。,中国[ちゅうごく] 語[ご]を 日本語[にほんご]にほんやくします。,I will translate Chinese into Japanese.,,,,,Ch 02 - 勉強と仕事,Sect 05 - 仕事②,X
JLPT_Tango_N4_0259-005,ほんやく家,ほんやく 家[か],translator,[sound:JLPT_Tango_N4_0259-005.mp3],,,,,,,Related meaning to ほんやく＜する＞,Ch 02 - 勉強と仕事,Sect 05 - 仕事②,
JLPT_Tango_N4_0260,通訳＜する＞,通訳[つうやく]＜する＞,interpreting,[sound:JLPT_Tango_N4_0260.mp3],小学生のころから通訳になりたかったです。,小学生[しょうがくせい]のころから 通訳[つうやく]になりたかったです。,I've wanted to be an interpreter since I was an elementary school student.,,,,,Ch 02 - 勉強と仕事,Sect 05 - 仕事②,X
JLPT_Tango_N4_0261,方法,方法[ほうほう],method,[sound:JLPT_Tango_N4_0261.mp3],日本語が上手になる方法を教えてください。,日本語[にほんご]が 上手[じょうず]になる 方法[ほうほう]を 教[おし]えてください。,Please teach me how to get better at Japanese.,,,,,Ch 02 - 勉強と仕事,Sect 05 - 仕事②,X
JLPT_Tango_N4_0262,しかた,しかた,way of doing something,[sound:JLPT_Tango_N4_0262.mp3],仕事のしかたをすぐにおぼえました。,仕事[しごと]のしかたをすぐにおぼえました。,I immediately memorized how to do the job.,,,,,Ch 02 - 勉強と仕事,Sect 05 - 仕事②,X
JLPT_Tango_N4_0262-005,やり方,やり 方[かた],way of doing something,[sound:JLPT_Tango_N4_0262-005.mp3],,,,,,,Same meaning as しかた,Ch 02 - 勉強と仕事,Sect 05 - 仕事②,
JLPT_Tango_N4_0263,慣れる,慣[な]れる,to get used to,[sound:JLPT_Tango_N4_0263.mp3],最近、やっと仕事に慣れました,最近[さいきん]、やっと 仕事[しごと]に 慣[な]れました,I've recently gotten used to my job.,,,,,Ch 02 - 勉強と仕事,Sect 05 - 仕事②,X
JLPT_Tango_N4_0264,うまくいく,うまくいく,to go well,[sound:JLPT_Tango_N4_0264.mp3],明日のスピーチはうまくいくでしょう。,明日[あした]のスピーチはうまくいくでしょう。,I wonder if the speech tomorrow will go well.,,,,,Ch 02 - 勉強と仕事,Sect 05 - 仕事②,X
JLPT_Tango_N4_0265,成功＜する＞,成功[せいこう]＜する＞,success,[sound:JLPT_Tango_N4_0265.mp3],田中さんは仕事で成功しました。,田中[たなか]さんは 仕事[しごと]で 成功[せいこう]しました。,Tanaka-san succeeded at his job.,,,,,Ch 02 - 勉強と仕事,Sect 05 - 仕事②,X
JLPT_Tango_N4_0266,たのむ,たのむ,"to ask, to request",[sound:JLPT_Tango_N4_0266.mp3],店長に仕事をたのまれました。,店長[てんちょう]に 仕事[しごと]をたのまれました。,I was asked to do a job by the store manager.,,,,,Ch 02 - 勉強と仕事,Sect 05 - 仕事②,X
JLPT_Tango_N4_0267,手伝う,手伝[てつだ]う,to help,[sound:JLPT_Tango_N4_0267.mp3],フランス語の通訳を手伝ってください。,フランス語[ふらんすご]の 通訳[つうやく]を 手伝[てつだ]ってください。,Please help us interpret French.,,,,,Ch 02 - 勉強と仕事,Sect 05 - 仕事②,X
JLPT_Tango_N4_0267-005,手伝い,手伝[てつだ]い,"help, assistance",[sound:JLPT_Tango_N4_0267-005.mp3],,,,,,,Related meaning to 手伝う,Ch 02 - 勉強と仕事,Sect 05 - 仕事②,
JLPT_Tango_N4_0268,残業＜する＞,残業[ざんぎょう]＜する＞,working overtime,[sound:JLPT_Tango_N4_0268.mp3],いそがしいときは残業します。,いそがしいときは 残業[ざんぎょう]します。,"When I am busy, I work overtime.",,,,,Ch 02 - 勉強と仕事,Sect 05 - 仕事②,X
JLPT_Tango_N4_0269-001,むり＜な＞,むり＜な＞,the impossible/impossible,[sound:JLPT_Tango_N4_0269-001.mp3],①　そんなむりを言わないでください。,①　そんなむりを 言[い]わないでください。,①　Please don't say such impossible things.,,,,,Ch 02 - 勉強と仕事,Sect 05 - 仕事②,X
JLPT_Tango_N4_0269-002,むり＜な＞,むり＜な＞,the impossible/impossible,[sound:JLPT_Tango_N4_0269-002.mp3],②　毎日アルバイトをするのはむりです。,②　 毎日[まいにち]アルバイトをするのはむりです。,②　It's impossible to work part-time everyday.,,,,,Ch 02 - 勉強と仕事,Sect 05 - 仕事②,X
JLPT_Tango_N4_0269-005,むりする,むりする,to do the impossible,[sound:JLPT_Tango_N4_0269-005.mp3],,,,,,,Related meaning to むり＜な＞,Ch 02 - 勉強と仕事,Sect 05 - 仕事②,
JLPT_Tango_N4_0270,急ぐ,急[いそ]ぐ,to hurry,[sound:JLPT_Tango_N4_0270.mp3],時間がないので、急いでください。,時間[じかん]がないので、 急[いそ]いでください。,"We don't have much time, so let's hurry.",,,,,Ch 02 - 勉強と仕事,Sect 05 - 仕事②,X
JLPT_Tango_N4_0271,昼休み,昼休[ひるやす]み,lunch break,[sound:JLPT_Tango_N4_0271.mp3],昼休みは１２時から１時間です。,昼休[ひるやす]みは １２[じゅうに] 時[じ]から１ 時間[じかん]です。,My lunch break is one hour starting at 12:00.,,,,,Ch 02 - 勉強と仕事,Sect 05 - 仕事②,X
JLPT_Tango_N4_0271-005,ランチ,ランチ,lunch,[sound:JLPT_Tango_N4_0271-005.mp3],,,,,,,Related meaning to 昼休み,Ch 02 - 勉強と仕事,Sect 05 - 仕事②,
JLPT_Tango_N4_0272,休けい＜する＞,休[きゅう]けい＜する＞,break,[sound:JLPT_Tango_N4_0272.mp3],３時ですから、ちょっと休けいしましょう。,３ 時[じ]ですから、ちょっと 休[きゅう]けいしましょう。,"It's 3:00, so let's take a break.",,,,,Ch 02 - 勉強と仕事,Sect 05 - 仕事②,X
JLPT_Tango_N4_0273,忘年会,忘年会[ぼうねんかい],year-end party,[sound:JLPT_Tango_N4_0273.mp3],来週、忘年会をしませんか。,来週[らいしゅう]、 忘年会[ぼうねんかい]をしませんか。,Why don't we have our year-end party next week?,,,,,Ch 02 - 勉強と仕事,Sect 05 - 仕事②,X
JLPT_Tango_N4_0273-005,新年会,新年[しんねん] 会[かい],start-of-the-year party,[sound:JLPT_Tango_N4_0273-005.mp3],,,,,,,Related meaning to 忘年会,Ch 02 - 勉強と仕事,Sect 05 - 仕事②,
JLPT_Tango_N4_0273-006,たんじょう会,たんじょう 会[かい],birthday party,[sound:JLPT_Tango_N4_0273-006.mp3],,,,,,,Related meaning to 忘年会,Ch 02 - 勉強と仕事,Sect 05 - 仕事②,
JLPT_Tango_N4_0273-007,飲み会,飲[の]み 会[かい],drinking party,[sound:JLPT_Tango_N4_0273-007.mp3],,,,,,,Related meaning to 忘年会,Ch 02 - 勉強と仕事,Sect 05 - 仕事②,
JLPT_Tango_N4_0273-008,二次会,二次会[にじかい],after party,[sound:JLPT_Tango_N4_0273-008.mp3],,,,,,,Related meaning to 忘年会,Ch 02 - 勉強と仕事,Sect 05 - 仕事②,
JLPT_Tango_N4_0274,公務員,公務員[こうむいん],civil servant,[sound:JLPT_Tango_N4_0274.mp3],父も母も公務員です。,父[ちち]も 母[はは]も 公務員[こうむいん]です。,Both my father and my mother are civil servants.,,,,,Ch 02 - 勉強と仕事,Sect 05 - 仕事②,X
JLPT_Tango_N4_0274-005,会社員,会社[かいしゃ] 員[いん],company employee,[sound:JLPT_Tango_N4_0274-005.mp3],,,,,,,Related meaning to 公務員,Ch 02 - 勉強と仕事,Sect 05 - 仕事②,
JLPT_Tango_N4_0274-006,駅員,駅員[えきいん],station employee,[sound:JLPT_Tango_N4_0274-006.mp3],,,,,,,Related meaning to 公務員,Ch 02 - 勉強と仕事,Sect 05 - 仕事②,
JLPT_Tango_N4_0274-007,銀行員,銀行[ぎんこう] 員[いん],bank employee,[sound:JLPT_Tango_N4_0274-007.mp3],,,,,,,Related meaning to 公務員,Ch 02 - 勉強と仕事,Sect 05 - 仕事②,
JLPT_Tango_N4_0275,弁護士,弁護士[べんごし],lawyer,[sound:JLPT_Tango_N4_0275.mp3],弁護士になるのはむずかしいです。,弁護士[べんごし]になるのはむずかしいです。,It's difficult to become a lawyer.,,,,,Ch 02 - 勉強と仕事,Sect 05 - 仕事②,X
JLPT_Tango_N4_0276,工場,工場[こうじょう],factory,[sound:JLPT_Tango_N4_0276.mp3],パンの工場でアルバイトしていました。,パンの 工場[こうじょう]でアルバイトしていました。,I worked part-time at a bread factory.,,,,,Ch 02 - 勉強と仕事,Sect 05 - 仕事②,X
JLPT_Tango_N4_0277,事務所,事務所[じむしょ],office,[sound:JLPT_Tango_N4_0277.mp3],事務所で昼ごはんを食べています。,事務所[じむしょ]で 昼[ひる]ごはんを 食[た]べています。,I'm eating lunch at the office.,,,,,Ch 02 - 勉強と仕事,Sect 05 - 仕事②,X
JLPT_Tango_N4_0278,ガイドブック,ガイドブック,guidebook,[sound:JLPT_Tango_N4_0278.mp3],本屋さんでガイドブックを買いました。,本屋[ほんや]さんでガイドブックを 買[か]いました。,I bought a guidebook at a book store.,,,,,Ch 03 - 楽しいこと,Sect 01 - 旅行,X
JLPT_Tango_N4_0279,時こく表,時[とき]こく 表[ひょう],timetable,[sound:JLPT_Tango_N4_0279.mp3],電車の時こく表はどこにありますか。,電車[でんしゃ]の 時[とき]こく 表[ひょう]はどこにありますか。,Where is the train timetable?,,,,,Ch 03 - 楽しいこと,Sect 01 - 旅行,X
JLPT_Tango_N4_0280,計画＜する＞,計画[けいかく]＜する＞,plan,[sound:JLPT_Tango_N4_0280.mp3],今年家族と旅行を計画しています。,今年[ことし] 家族[かぞく]と 旅行[りょこう]を 計画[けいかく]しています。,"This year, I plan to go to a trip with my family.",,,,,Ch 03 - 楽しいこと,Sect 01 - 旅行,X
JLPT_Tango_N4_0281,遠く,遠[とお]く,far (away),[sound:JLPT_Tango_N4_0281.mp3],たまには遠くへ行きたいです。,たまには 遠[とお]くへ 行[い]きたいです。,"Sometimes, I like to travel to someplace far away.",,,,,Ch 03 - 楽しいこと,Sect 01 - 旅行,X
JLPT_Tango_N4_0281-005,近く,近[ちか]く,close (nearby),[sound:JLPT_Tango_N4_0281-005.mp3],,,,,,,Opposite meaning of 遠く,Ch 03 - 楽しいこと,Sect 01 - 旅行,
JLPT_Tango_N4_0282,海外,海外[かいがい],overseas,[sound:JLPT_Tango_N4_0282.mp3],夏休みに海外へ行きたいと思っています。,夏休[なつやす]みに 海外[かいがい]へ 行[い]きたいと 思[おも]っています。,I would like to travel overseas during summer vacation.,,,,,Ch 03 - 楽しいこと,Sect 01 - 旅行,X
JLPT_Tango_N4_0282-005,外国,外国[がいこく],overseas,[sound:JLPT_Tango_N4_0282-005.mp3],,,,,,,Same meaning as 海外,Ch 03 - 楽しいこと,Sect 01 - 旅行,
JLPT_Tango_N4_0282-006,海外旅行,海外[かいがい] 旅行[りょこう],overseas trip,[sound:JLPT_Tango_N4_0282-006.mp3],,,,,,,Related meaning to 海外,Ch 03 - 楽しいこと,Sect 01 - 旅行,
JLPT_Tango_N4_0282-007,外国旅行,外国[がいこく] 旅行[りょこう],traveling to another country,[sound:JLPT_Tango_N4_0282-007.mp3],,,,,,,Related meaning to 海外,Ch 03 - 楽しいこと,Sect 01 - 旅行,
JLPT_Tango_N4_0283,国内,国内[こくない],"domestic, in the country",[sound:JLPT_Tango_N4_0283.mp3],夏に母と国内を旅行します。,夏[なつ]に 母[はは]と 国内[こくない]を 旅行[りょこう]します。,"In the summer, I'm going to travel the country with my mother.",,,,,Ch 03 - 楽しいこと,Sect 01 - 旅行,X
JLPT_Tango_N4_0283-005,国内旅行,国内[こくない] 旅行[りょこう],domestic trip,[sound:JLPT_Tango_N4_0283-005.mp3],,,,,,,Related meaning to 国内,Ch 03 - 楽しいこと,Sect 01 - 旅行,
JLPT_Tango_N4_0284,景色,景色[けしき],scenery,[sound:JLPT_Tango_N4_0284.mp3],ここから見る景色はほんとうにきれいですね。,ここから 見[み]る 景色[けしき]はほんとうにきれいですね。,The scenery visible from here is really beautiful.,,,,,Ch 03 - 楽しいこと,Sect 01 - 旅行,X
JLPT_Tango_N4_0285,【お】祭り,【お】 祭[まつ]り,festival,[sound:JLPT_Tango_N4_0285.mp3],日本にはおもしろい祭りが多いです。,日本[にほん]にはおもしろい 祭[まつ]りが 多[おお]いです。,There are many interesting festivals in Japan.,,,,,Ch 03 - 楽しいこと,Sect 01 - 旅行,X
JLPT_Tango_N4_0285-005,夏祭り,夏[なつ] 祭[まつ]り,summer festival,[sound:JLPT_Tango_N4_0285-005.mp3],,,,,,,Related meaning to 【お】祭り,Ch 03 - 楽しいこと,Sect 01 - 旅行,
JLPT_Tango_N4_0285-006,秋祭り,秋祭[あきまつ]り,fall festival,[sound:JLPT_Tango_N4_0285-006.mp3],,,,,,,Related meaning to 【お】祭り,Ch 03 - 楽しいこと,Sect 01 - 旅行,
JLPT_Tango_N4_0285-007,雪祭り,雪[ゆき] 祭[まつ]り,winter festival,[sound:JLPT_Tango_N4_0285-007.mp3],,,,,,,Related meaning to 【お】祭り,Ch 03 - 楽しいこと,Sect 01 - 旅行,
JLPT_Tango_N4_0286,花火,花火[はなび],fireworks,[sound:JLPT_Tango_N4_0286.mp3],日本の花火の技術は世界一です。,日本[にほん]の 花火[はなび]の 技術[ぎじゅつ]は 世界一[せかいいち]です。,Japanese fireworks engineering is the best in the world.,,,,,Ch 03 - 楽しいこと,Sect 01 - 旅行,X
JLPT_Tango_N4_0286-005,花火大会,花火[はなび] 大会[たいかい],fireworks festival,[sound:JLPT_Tango_N4_0286-005.mp3],,,,,,,Related meaning to 花火,Ch 03 - 楽しいこと,Sect 01 - 旅行,
JLPT_Tango_N4_0287,連休,連休[れんきゅう],"extended weekend, ~-day weekend",[sound:JLPT_Tango_N4_0287.mp3],もうすぐうれしい４連休です。,もうすぐうれしい４ 連休[れんきゅう]です。,I'm happy for the four-day weekend we're about to have.,,,,,Ch 03 - 楽しいこと,Sect 01 - 旅行,X
JLPT_Tango_N4_0287-005,３連休,３ 連休[れんきゅう],three-day weekend,[sound:JLPT_Tango_N4_0287-005.mp3],,,,,,,Related meaning to 連休,Ch 03 - 楽しいこと,Sect 01 - 旅行,
JLPT_Tango_N4_0287-006,ゴールデンウィーク,ゴールデンウィーク,Golden Week,[sound:JLPT_Tango_N4_0287-006.mp3],,,,,,,Related meaning to 連休,Ch 03 - 楽しいこと,Sect 01 - 旅行,
JLPT_Tango_N4_0288,【お】正月,【お】 正月[しょうがつ],New Year's,[sound:JLPT_Tango_N4_0288.mp3],お正月の休みに国へ帰るつもりです。,お 正月[しょうがつ]の 休[やす]みに 国[くに]へ 帰[かえ]るつもりです。,I intend to go back to my country during the New Year's holiday.,,,,,Ch 03 - 楽しいこと,Sect 01 - 旅行,X
JLPT_Tango_N4_0288-005,お年玉,お 年玉[としだま],"otoshidama, Japanese New Year's greeting cards with money",[sound:JLPT_Tango_N4_0288-005.mp3],,,,,,,Related meaning to 【お】正月,Ch 03 - 楽しいこと,Sect 01 - 旅行,
JLPT_Tango_N4_0289,旅行社,旅行[りょこう] 社[しゃ],travel agency,[sound:JLPT_Tango_N4_0289.mp3],駅の近くの旅行社はとても親切です。,駅[えき]の 近[ちか]くの 旅行[りょこう] 社[しゃ]はとても 親切[しんせつ]です。,The travel agency near the station is really kind.,,,,,Ch 03 - 楽しいこと,Sect 01 - 旅行,X
JLPT_Tango_N4_0289-005,旅行会社,旅行[りょこう] 会社[かいしゃ],travel agency,[sound:JLPT_Tango_N4_0289-005.mp3],,,,,,,Same meaning as 旅行社,Ch 03 - 楽しいこと,Sect 01 - 旅行,
JLPT_Tango_N4_0290,申し込む,申し込[もうしこ]む,to apply,[sound:JLPT_Tango_N4_0290.mp3],友だちとハワイ旅行を申し込みました。,友[とも]だちとハワイ 旅行[りょこう]を 申し込[もうしこ]みました。,I applied for a trip to Hawaii with my friend.,,,,,Ch 03 - 楽しいこと,Sect 01 - 旅行,X
JLPT_Tango_N4_0290-005,申し込み,申し込[もうしこ]み,application,[sound:JLPT_Tango_N4_0290-005.mp3],,,,,,,Related meaning to 申し込む,Ch 03 - 楽しいこと,Sect 01 - 旅行,
JLPT_Tango_N4_0291,シングル（ベッド）,シングル（ベッド）,room with a single bed,[sound:JLPT_Tango_N4_0291.mp3],シングルの部屋を予約しました。,シングルの 部屋[へや]を 予約[よやく]しました。,I reserved a room with a single bed.,,,,ベッド is usually omitted.,Ch 03 - 楽しいこと,Sect 01 - 旅行,X
JLPT_Tango_N4_0291-005,ツイン（ベッド）,ツイン（ベッド）,room with a twin bed,[sound:JLPT_Tango_N4_0291-005.mp3],,,,,,,ベッド is usually omitted.. Related meaning to シングル（ベッド）,Ch 03 - 楽しいこと,Sect 01 - 旅行,
