Sort Index,Vocab-Japan,Vocab-Furigana,Vocab-English,audio file,Sent-Japan,Sent-Furigana,Sent-English,Alternate,Vocab-Pitch,Vocab-POS,Note-Question side,Note-Answer side,Chapter,Section,Gener Sent
JLPT_Tango_N3_1080,政府,政府[せいふ],government,[sound:JLPT_Tango_N3_1080.mp3],政府から大切な発表があった。,政府[せいふ]から 大切[たいせつ]な 発表[はっぴょう]があった。,There was an important announcement from the government.,,,,,,Ch 10 - ニュースで学ぼう！,Sect 01 - マスコミ,X
JLPT_Tango_N3_1081,市民,市民[しみん],citizen,[sound:JLPT_Tango_N3_1081.mp3],広場に多くの市民が集まった。,広場[ひろば]に 多[おお]くの 市民[しみん]が 集[あつ]まった。,Many citizens gathered in the open area.,,,,,,Ch 10 - ニュースで学ぼう！,Sect 01 - マスコミ,X
JLPT_Tango_N3_1081-005,国民,国民[こくみん],"a nation, a people",[sound:JLPT_Tango_N3_1081-005.mp3],,,,,,,,related or similar to 市民,Ch 10 - ニュースで学ぼう！,Sect 01 - マスコミ,
JLPT_Tango_N3_1082,立場,立場[たちば],"position, standpoint",[sound:JLPT_Tango_N3_1082.mp3],あの政治家は、国民の立場で話をする。,あの 政治[せいじ] 家[か]は、 国民[こくみん]の 立場[たちば]で 話[はなし]をする。,That politician speaks from the standpoint of the people.,,,,,,Ch 10 - ニュースで学ぼう！,Sect 01 - マスコミ,X
JLPT_Tango_N3_1083,世の中,世の中[よのなか],"world, in the world",[sound:JLPT_Tango_N3_1083.mp3],みんなが暮らしやすい世の中になってほしい。,みんなが 暮[く]らしやすい 世の中[よのなか]になってほしい。,I hope this world will become a comfortable place to live in for everyone.,,,,,,Ch 10 - ニュースで学ぼう！,Sect 01 - マスコミ,X
JLPT_Tango_N3_1083-005,社会,社会[しゃかい],"world, in the world",[sound:JLPT_Tango_N3_1083-005.mp3],,,,,,,,same meaning as 世の中,Ch 10 - ニュースで学ぼう！,Sect 01 - マスコミ,
JLPT_Tango_N3_1084,重大な,重大[じゅうだい]な,"serious, important",[sound:JLPT_Tango_N3_1084.mp3],車の会社が重大な発表をした。,車[くるま]の 会社[かいしゃ]が 重大[じゅうだい]な 発表[はっぴょう]をした。,The car company made an important announcement.,重大,,,,,Ch 10 - ニュースで学ぼう！,Sect 01 - マスコミ,X
JLPT_Tango_N3_1085,重要な,重要[じゅうよう]な,important,[sound:JLPT_Tango_N3_1085.mp3],今日は重要なニュースが多かった。,今日[きょう]は 重要[じゅうよう]なニュースが 多[おお]かった。,"Today, there was a lot of important news.",重要,,,,,Ch 10 - ニュースで学ぼう！,Sect 01 - マスコミ,X
JLPT_Tango_N3_1086,大して,大[たい]して,"(not so) much, (not) very",[sound:JLPT_Tango_N3_1086.mp3],この番組は、日本語の勉強に大して役に立たない。,この 番組[ばんぐみ]は、 日本語[にほんご]の 勉強[べんきょう]に 大[たい]して 役に立[やくにた]たない。,This TV program isn't much help for studying Japanese.,,,,,,Ch 10 - ニュースで学ぼう！,Sect 01 - マスコミ,X
JLPT_Tango_N3_1086-005,大したことがない,大[たい]したことがない,nothing special,[sound:JLPT_Tango_N3_1086-005.mp3],,,,大した,,,,related or similar to 大して,Ch 10 - ニュースで学ぼう！,Sect 01 - マスコミ,
JLPT_Tango_N3_1087,くだらない,くだらない,"trivial, good-for-nothing",[sound:JLPT_Tango_N3_1087.mp3],くだらない番組を、つい見てしまう。,くだらない 番組[ばんぐみ]を、つい 見[み]てしまう。,I always end up watching trivial shows.,,,,,,Ch 10 - ニュースで学ぼう！,Sect 01 - マスコミ,X
JLPT_Tango_N3_1088,司会者,司会[しかい] 者[しゃ],"master of ceremonies, host",[sound:JLPT_Tango_N3_1088.mp3],春から、番組の司会者がかわった。,春[はる]から、 番組[ばんぐみ]の 司会[しかい] 者[しゃ]がかわった。,The show's host changed in the spring.,,,,,,Ch 10 - ニュースで学ぼう！,Sect 01 - マスコミ,X
JLPT_Tango_N3_1088-005,司会＜する＞,司会[しかい]＜する＞,"host, moderating",[sound:JLPT_Tango_N3_1088-005.mp3],,,,,,,,related or similar to 司会者,Ch 10 - ニュースで学ぼう！,Sect 01 - マスコミ,
JLPT_Tango_N3_1089,生放送,生放送[なまほうそう],live broadcast,[sound:JLPT_Tango_N3_1089.mp3],生放送の途中で、何か問題が起きたらしい。,生放送[なまほうそう]の 途中[とちゅう]で、 何[なに]か 問題[もんだい]が 起[お]きたらしい。,It seems that a problem occurred during the live broadcast.,,,,,,Ch 10 - ニュースで学ぼう！,Sect 01 - マスコミ,X
JLPT_Tango_N3_1089-005,再放送,再[さい] 放送[ほうそう],"rerun, rebroadcasting",[sound:JLPT_Tango_N3_1089-005.mp3],,,,,,,,related or similar to 生放送,Ch 10 - ニュースで学ぼう！,Sect 01 - マスコミ,
JLPT_Tango_N3_1089-006,ライブ,ライブ,live broadcast,[sound:JLPT_Tango_N3_1089-006.mp3],,,,,,,,same meaning as 生放送,Ch 10 - ニュースで学ぼう！,Sect 01 - マスコミ,
JLPT_Tango_N3_1090,商品,商品[しょうひん],"goods, merchandise",[sound:JLPT_Tango_N3_1090.mp3],この商品は、とても売れている。,この 商品[しょうひん]は、とても 売[う]れている。,This merchandise is really selling.,,,,,,Ch 10 - ニュースで学ぼう！,Sect 01 - マスコミ,X
JLPT_Tango_N3_1090-005,新商品,新[しん] 商品[しょうひん],"new product, new merchandise",[sound:JLPT_Tango_N3_1090-005.mp3],,,,,,,,related or similar to 商品,Ch 10 - ニュースで学ぼう！,Sect 01 - マスコミ,
JLPT_Tango_N3_1091,発売＜する＞,発売[はつばい]＜する＞,putting something on the market,[sound:JLPT_Tango_N3_1091.mp3],明日、新しいゲームが発売される。,明日[あした]、 新[あたら]しいゲームが 発売[はつばい]される。,"Tomorrow, a new game goes on sale.",,,,,,Ch 10 - ニュースで学ぼう！,Sect 01 - マスコミ,X
JLPT_Tango_N3_1091-005,新発売,新[しん] 発売[はつばい],new product on the market,[sound:JLPT_Tango_N3_1091-005.mp3],,,,,,,,related or similar to 発売＜する＞,Ch 10 - ニュースで学ぼう！,Sect 01 - マスコミ,
JLPT_Tango_N3_1092,評判,評判[ひょうばん],reputation,[sound:JLPT_Tango_N3_1092.mp3],新しく出版された雑誌は、評判がいい。,新[あたら]しく 出版[しゅっぱん]された 雑誌[ざっし]は、 評判[ひょうばん]がいい。,The newly published magazine has a good reputation.,,,,,,Ch 10 - ニュースで学ぼう！,Sect 01 - マスコミ,X
JLPT_Tango_N3_1093,注目＜する＞,注目[ちゅうもく]＜する＞,"notice, attention",[sound:JLPT_Tango_N3_1093.mp3],世界中の人が、その女優に注目している。,世界中[せかいじゅう]の 人[ひと]が、その 女優[じょゆう]に 注目[ちゅうもく]している。,People around the world are taking notice of that actress.,,,,,,Ch 10 - ニュースで学ぼう！,Sect 01 - マスコミ,X
JLPT_Tango_N3_1094,ヒット＜する＞,ヒット＜する＞,hit,[sound:JLPT_Tango_N3_1094.mp3],今一番ヒットしている曲をダウンロードした。,今[いま] 一番[いちばん]ヒットしている 曲[きょく]をダウンロードした。,I downloaded the biggest hit song right now.,ヒット-hit,,,,,Ch 10 - ニュースで学ぼう！,Sect 01 - マスコミ,X
JLPT_Tango_N3_1094-005,ヒット商品,ヒット 商品[しょうひん],hit product,[sound:JLPT_Tango_N3_1094-005.mp3],,,,,,,,related or similar to ヒット＜する＞,Ch 10 - ニュースで学ぼう！,Sect 01 - マスコミ,
JLPT_Tango_N3_1094-006,ヒット作,ヒット 作[さく],"hit piece, popular work",[sound:JLPT_Tango_N3_1094-006.mp3],,,,,,,,related or similar to ヒット＜する＞,Ch 10 - ニュースで学ぼう！,Sect 01 - マスコミ,
JLPT_Tango_N3_1094-007,ヒット曲,ヒット 曲[きょく],hit song,[sound:JLPT_Tango_N3_1094-007.mp3],,,,,,,,related or similar to ヒット＜する＞,Ch 10 - ニュースで学ぼう！,Sect 01 - マスコミ,
JLPT_Tango_N3_1095,やっぱり,やっぱり,as I thought,[sound:JLPT_Tango_N3_1095.mp3],A「あの二人は結婚するそうですね。」<div>B「やっぱり二人は付き合っていたんですね。」</div>,A「あの二人[ふたり]は 結婚[けっこん]するそうですね。」<div>B「やっぱり二人[ふたり]は 付き合[つきあ]っていたんですね。」</div>,"A: I hear that those two are going to get married.<div>B: So they had been dating, just as I thought.</div>",,,,,"In conversation, just やっぱり alone can be used to convey that something happened just as one thought it would.",Ch 10 - ニュースで学ぼう！,Sect 01 - マスコミ,X
JLPT_Tango_N3_1095-005,やはり,やはり,as I thought,[sound:JLPT_Tango_N3_1095-005.mp3],,,,,,,,same meaning as やっぱり<div>(written word)</div>,Ch 10 - ニュースで学ぼう！,Sect 01 - マスコミ,
JLPT_Tango_N3_1096,まさか,まさか,"no way, cannot be",[sound:JLPT_Tango_N3_1096.mp3],A「あの番組の司会者が、昨日入院したって。」<div>B「まさか。あんなに元気だったのに。」</div>,A「あの 番組[ばんぐみ]の 司会[しかい] 者[しゃ]が、 昨日[きのう] 入院[にゅういん]したって。」<div>B「まさか。あんなに 元気[げんき]だったのに。」</div>,A: I hear the host of that show was hospitalized yesterday.<div>B: No way. And he seemed so healthy.</div>,,,,,"In conversation, just まさか alone can be used to convey that one cannot believe what has happened.",Ch 10 - ニュースで学ぼう！,Sect 01 - マスコミ,X
JLPT_Tango_N3_1097,やっと,やっと,finally,[sound:JLPT_Tango_N3_1097.mp3],A国とB国の問題が、やっと解決された。,A国[エーこく]と B国[ビーこく]の 問題[もんだい]が、やっと 解決[かいけつ]された。,The problem between country A and country B has finally been resolved.,,,,,,Ch 10 - ニュースで学ぼう！,Sect 01 - マスコミ,X
JLPT_Tango_N3_1098,結局,結局[けっきょく],"ultimately, in the end",[sound:JLPT_Tango_N3_1098.mp3],結局、この記事はうそだった。,結局[けっきょく]、この 記事[きじ]はうそだった。,"In the end, this article was a fabrication.",,,,,,Ch 10 - ニュースで学ぼう！,Sect 01 - マスコミ,X
JLPT_Tango_N3_1099,怪しい,怪[あや]しい,suspicious,[sound:JLPT_Tango_N3_1099.mp3],怪しい人を見たら、警察に連絡してください。,怪[あや]しい 人[ひと]を 見[み]たら、 警察[けいさつ]に 連絡[れんらく]してください。,If you see a suspicious person please inform the police.,,,,,,Ch 10 - ニュースで学ぼう！,Sect 02 - 事件,X
JLPT_Tango_N3_1100,恐ろしい,恐[おそ]ろしい,"horrible, frightful",[sound:JLPT_Tango_N3_1100.mp3],最近は、恐ろしい事件が多い。,最近[さいきん]は、 恐[おそ]ろしい 事件[じけん]が 多[おお]い。,"Lately, there have been many frightful incidents.",,,,,,Ch 10 - ニュースで学ぼう！,Sect 02 - 事件,X
JLPT_Tango_N3_1101,暴れる,暴[あば]れる,"to behave violently, to be unruly",[sound:JLPT_Tango_N3_1101.mp3],この近くで、男が暴れていたらしい。,この 近[ちか]くで、 男[おとこ]が 暴[あば]れていたらしい。,They say there was a man behaving violently in this area.,,,,,,Ch 10 - ニュースで学ぼう！,Sect 02 - 事件,X
JLPT_Tango_N3_1101-005,暴力,暴力[ぼうりょく],violence,[sound:JLPT_Tango_N3_1101-005.mp3],,,,,,,,related or similar to 暴れる,Ch 10 - ニュースで学ぼう！,Sect 02 - 事件,
JLPT_Tango_N3_1102,争う,争[あらそ]う,to fight,[sound:JLPT_Tango_N3_1102.mp3],夜中に、男性と女性が争う声が聞こえた。,夜中[やちゅう]に、 男性[だんせい]と 女性[じょせい]が 争[あらそ]う 声[こえ]が 聞[き]こえた。,"In the night, I heard the voices of a man and a woman fighting.",,,,,,Ch 10 - ニュースで学ぼう！,Sect 02 - 事件,X
JLPT_Tango_N3_1102-005,言い争い,言い争[いいあらそ]い,"argument, verbal fight",[sound:JLPT_Tango_N3_1102-005.mp3],,,,,,,,related or similar to 争う,Ch 10 - ニュースで学ぼう！,Sect 02 - 事件,
JLPT_Tango_N3_1102-006,争い,争[あらそ]い,"fight, battle",[sound:JLPT_Tango_N3_1102-006.mp3],,,,,,,,related or similar to 争う,Ch 10 - ニュースで学ぼう！,Sect 02 - 事件,
JLPT_Tango_N3_1103,犯罪,犯罪[はんざい],crime,[sound:JLPT_Tango_N3_1103.mp3],あの町は犯罪が多い。,あの 町[まち]は 犯罪[はんざい]が 多[おお]い。,That town has a lot of crime.,,,,,,Ch 10 - ニュースで学ぼう！,Sect 02 - 事件,X
JLPT_Tango_N3_1104,発見者,発見[はっけん] 者[しゃ],discoverer,[sound:JLPT_Tango_N3_1104.mp3],警察は、怪しいかばんの発見者に話を聞いている。,警察[けいさつ]は、 怪[あや]しいかばんの 発見[はっけん] 者[しゃ]に 話[はなし]を 聞[き]いている。,The police are talking to the person who found the suspicious bag.,,,,,,Ch 10 - ニュースで学ぼう！,Sect 02 - 事件,X
JLPT_Tango_N3_1105,疑う,疑[うたが]う,to doubt,[sound:JLPT_Tango_N3_1105.mp3],警察に、第一発見者が疑われているようだ。,警察[けいさつ]に、 第一[だいいち] 発見[はっけん] 者[しゃ]が 疑[うたが]われているようだ。,The police are doubting the initial discoverer.,,,,,,Ch 10 - ニュースで学ぼう！,Sect 02 - 事件,X
JLPT_Tango_N3_1105-005,疑い,疑[うたが]い,doubt,[sound:JLPT_Tango_N3_1105-005.mp3],,,,,,,,related or similar to 疑う,Ch 10 - ニュースで学ぼう！,Sect 02 - 事件,
JLPT_Tango_N3_1106,うそつき,うそつき,liar,[sound:JLPT_Tango_N3_1106.mp3],だれも彼をうそつきとは思わなかった。,だれも 彼[かれ]をうそつきとは 思[おも]わなかった。,No one though he was a liar.,,,,,,Ch 10 - ニュースで学ぼう！,Sect 02 - 事件,X
JLPT_Tango_N3_1107,犯人,犯人[はんにん],"culprit, criminal",[sound:JLPT_Tango_N3_1107.mp3],犯人は、二十歳くらいの男らしい。,犯人[はんにん]は、二十歳[はたち]くらいの 男[おとこ]らしい。,It seems the culprit is a man of about 20.,,,,,,Ch 10 - ニュースで学ぼう！,Sect 02 - 事件,X
JLPT_Tango_N3_1108-001,いたずら＜な／する＞,いたずら＜な／する＞,"prank, practical joke, mischief",[sound:JLPT_Tango_N3_1108-001.mp3],①　子どものいたずらが、大きな事件になった。,①　子[こ]どものいたずらが、 大[おお]きな 事件[じけん]になった。,①　The child's prank turned into a big ordeal.,悪戯,,,,,Ch 10 - ニュースで学ぼう！,Sect 02 - 事件,X
JLPT_Tango_N3_1108-002,いたずら＜な／する＞,いたずら＜な／する＞,"prank, practical joke, mischief",[sound:JLPT_Tango_N3_1108-002.mp3],②　いたずらな子どもが、線路に石を置いた。,②　いたずらな 子[こ]どもが、 線路[せんろ]に 石[いし]を 置[お]いた。,②　A mischievous child put a rock on the railway tracks.,,,,,,Ch 10 - ニュースで学ぼう！,Sect 02 - 事件,X
JLPT_Tango_N3_1109,さけぶ,さけぶ,"to scream, to shout",[sound:JLPT_Tango_N3_1109.mp3],外で女性が大きな声でさけんでいる。,外[そと]で 女性[じょせい]が 大[おお]きな 声[こえ]でさけんでいる。,"Outside, a woman is screaming in a loud voice.",叫ぶ,,,,,Ch 10 - ニュースで学ぼう！,Sect 02 - 事件,X
JLPT_Tango_N3_1109-005,さけび声,さけび 声[ごえ],"shout, scream",[sound:JLPT_Tango_N3_1109-005.mp3],,,,叫び声,,,,related or similar to さけぶ,Ch 10 - ニュースで学ぼう！,Sect 02 - 事件,
JLPT_Tango_N3_1110,たたく,たたく,"to strike, to hit",[sound:JLPT_Tango_N3_1110.mp3],だれかがドアをたたいている。,だれかがドアをたたいている。,Someone is knocking on the door.,叩く,,,,,Ch 10 - ニュースで学ぼう！,Sect 02 - 事件,X
JLPT_Tango_N3_1110-005,ぶつ,ぶつ,"to hit, to beat",[sound:JLPT_Tango_N3_1110-005.mp3],,,,,,,,related or similar to たたく,Ch 10 - ニュースで学ぼう！,Sect 02 - 事件,
JLPT_Tango_N3_1111,盗む,盗[ぬす]む,to steal,[sound:JLPT_Tango_N3_1111.mp3],泥棒に指輪を盗まれた。,泥棒[どろぼう]に 指輪[ゆびわ]を 盗[ぬす]まれた。,My ring was stolen by a thief.,,,,,,Ch 10 - ニュースで学ぼう！,Sect 02 - 事件,X
JLPT_Tango_N3_1112,うばう,うばう,to take,[sound:JLPT_Tango_N3_1112.mp3],道を歩いていて、ハンドバッグをうばわれた。,道[みち]を 歩[ある]いていて、ハンドバッグをうばわれた。,I was walking down the street when my handbag was taken.,奪う,,,,,Ch 10 - ニュースで学ぼう！,Sect 02 - 事件,X
JLPT_Tango_N3_1113,捜す,捜[さが]す,to look for,[sound:JLPT_Tango_N3_1113.mp3],警察が犯人を捜している。,警察[けいさつ]が 犯人[はんにん]を 捜[さが]している。,The police are looking for the culprit.,探す,,,,,Ch 10 - ニュースで学ぼう！,Sect 02 - 事件,X
JLPT_Tango_N3_1114,追う,追[お]う,"to chase, to pursue",[sound:JLPT_Tango_N3_1114.mp3],警察が犯人を追っている。,警察[けいさつ]が 犯人[はんにん]を 追[お]っている。,The police are pursuing the culprit.,,,,,,Ch 10 - ニュースで学ぼう！,Sect 02 - 事件,X
JLPT_Tango_N3_1115,捕まえる,捕[つか]まえる,to cach,[sound:JLPT_Tango_N3_1115.mp3],警察が犯人をやっと捕まえた。,警察[けいさつ]が 犯人[はんにん]をやっと 捕[つか]まえた。,The police finally caught the culprit.,,,,,,Ch 10 - ニュースで学ぼう！,Sect 02 - 事件,X
JLPT_Tango_N3_1116,捕まる,捕[つか]まる,to be caught,[sound:JLPT_Tango_N3_1116.mp3],家の近くで、犯人が捕まった。,家[いえ]の 近[ちか]くで、 犯人[はんにん]が 捕[つか]まった。,The criminal was caught near my house.,,,,,,Ch 10 - ニュースで学ぼう！,Sect 02 - 事件,X
JLPT_Tango_N3_1117,逮捕＜する＞,逮捕[たいほ]＜する＞,arrest,[sound:JLPT_Tango_N3_1117.mp3],犯人が逮捕されて、市民は安心した。,犯人[はんにん]が 逮捕[たいほ]されて、 市民[しみん]は 安心[あんしん]した。,"The culprit was arrested, and the citizens were all relieved.",,,,,,Ch 10 - ニュースで学ぼう！,Sect 02 - 事件,X
JLPT_Tango_N3_1118,気味が悪い,気味が悪[きみがわる]い,"creepy, uneasy feeling",[sound:JLPT_Tango_N3_1118.mp3],知らない人から電話がかかってきて、気味が悪い。,知[し]らない 人[ひと]から 電話[でんわ]がかかってきて、 気味が悪[きみがわる]い。,I felt uneasy when I got a call from someone I didn't know.,気味,,,,,Ch 10 - ニュースで学ぼう！,Sect 02 - 事件,X
JLPT_Tango_N3_1119,パトカー,パトカー,"patrol car, police car",[sound:JLPT_Tango_N3_1119.mp3],昨日、深夜までパトカーの音が聞こえた。,昨日[きのう]、 深夜[しんや]までパトカーの 音[おと]が 聞[き]こえた。,"Yesterday, I heard the sound of police cars all throughout the night.",,,,,,Ch 10 - ニュースで学ぼう！,Sect 02 - 事件,X
JLPT_Tango_N3_1119-005,救急車,救急[きゅうきゅう] 車[しゃ],ambulance,[sound:JLPT_Tango_N3_1119-005.mp3],,,,,,,,related or similar to パトカー,Ch 10 - ニュースで学ぼう！,Sect 02 - 事件,
JLPT_Tango_N3_1120,（事故に）あう,（ 事故[じこ]に）あう,to have (an accident),[sound:JLPT_Tango_N3_1120.mp3],子どものころ、交通事故にあったことがある。,子[こ]どものころ、 交通[こうつう] 事故[じこ]にあったことがある。,"When I was a child, I was one in a traffic accident.",,,,,The kanji for this あう is遭う.,Ch 10 - ニュースで学ぼう！,Sect 03 - 気をつけよう！,X
JLPT_Tango_N3_1121,発生＜する＞,発生[はっせい]＜する＞,to occur,[sound:JLPT_Tango_N3_1121.mp3],あの交差手では、毎日事故が発生している。,あの 交差[こうさ] 手[しゅ]では、 毎日[まいにち] 事故[じこ]が 発生[はっせい]している。,Accidents occur every day at that intersection.,,,,,,Ch 10 - ニュースで学ぼう！,Sect 03 - 気をつけよう！,X
JLPT_Tango_N3_1122,命,命[いのち],life,[sound:JLPT_Tango_N3_1122.mp3],命は何よりも大切だ。,命[いのち]は 何[なに]よりも 大切[たいせつ]だ。,Nothing is more important than life.,,,,,,Ch 10 - ニュースで学ぼう！,Sect 03 - 気をつけよう！,X
JLPT_Tango_N3_1123,救う,救[すく]う,"to save, to rescue",[sound:JLPT_Tango_N3_1123.mp3],知らない人に、命を救ってもらった。,知[し]らない 人[ひと]に、 命[いのち]を 救[すく]ってもらった。,A stranger saved my life.,,,,,,Ch 10 - ニュースで学ぼう！,Sect 03 - 気をつけよう！,X
JLPT_Tango_N3_1124,そうぞうしい,そうぞうしい,"noisy, boisterous",[sound:JLPT_Tango_N3_1124.mp3],信号の近くが、ずいぶんそうぞうしい。,信号[しんごう]の 近[ちか]くが、ずいぶんそうぞうしい。,There's quite a commotion near the traffic signal.,騒々しい,,,,,Ch 10 - ニュースで学ぼう！,Sect 03 - 気をつけよう！,X
JLPT_Tango_N3_1124-005,さわがしい,さわがしい,"noisy, boisterous",[sound:JLPT_Tango_N3_1124-005.mp3],,,,騒がしい,,,,same meaning as そうぞうしい,Ch 10 - ニュースで学ぼう！,Sect 03 - 気をつけよう！,
JLPT_Tango_N3_1125,さがぐ,さがぐ,to make noise,[sound:JLPT_Tango_N3_1125.mp3],交差点でさわいでいる人がいる。,交差点[こうさてん]でさわいでいる 人[ひと]がいる。,There is a person causing a scene aat the intersection.,,,,,,Ch 10 - ニュースで学ぼう！,Sect 03 - 気をつけよう！,X
JLPT_Tango_N3_1126,現場,現場[げんば],"actual spot, scene of the crime, site",[sound:JLPT_Tango_N3_1126.mp3],大きな音がしたので、現場に行ってみた。,大[おお]きな 音[おと]がしたので、 現場[げんば]に 行[い]ってみた。,"There was a loud noise, so I went to see where it came from.",,,,,,Ch 10 - ニュースで学ぼう！,Sect 03 - 気をつけよう！,X
JLPT_Tango_N3_1126-005,工事現場,工事[こうじ] 現場[げんば],construction site,[sound:JLPT_Tango_N3_1126-005.mp3],,,,,,,,related or similar to 現場,Ch 10 - ニュースで学ぼう！,Sect 03 - 気をつけよう！,
JLPT_Tango_N3_1126-006,事件現場,事件[じけん] 現場[げんば],scene of an incident,[sound:JLPT_Tango_N3_1126-006.mp3],,,,事件,,,,related or similar to 現場,Ch 10 - ニュースで学ぼう！,Sect 03 - 気をつけよう！,
JLPT_Tango_N3_1126-007,事故現場,事故[じこ] 現場[げんば],scene of an accident,[sound:JLPT_Tango_N3_1126-007.mp3],,,,,,,,related or similar to 現場,Ch 10 - ニュースで学ぼう！,Sect 03 - 気をつけよう！,
JLPT_Tango_N3_1127,混乱＜する＞,混乱[こんらん]＜する＞,"confusion, chaos",[sound:JLPT_Tango_N3_1127.mp3],現場は、警察を多くの人で混乱している。,現場[げんば]は、 警察[けいさつ]を 多[おお]くの 人[ひと]で 混乱[こんらん]している。,The scene is chaotic with police officers and so many people.,,,,,,Ch 10 - ニュースで学ぼう！,Sect 03 - 気をつけよう！,X
JLPT_Tango_N3_1128,パニック,パニック,panic,[sound:JLPT_Tango_N3_1128.mp3],大きな事故の現場を見て、パニックになった。,大[おお]きな 事故[じこ]の 現場[げんば]を 見[み]て、パニックになった。,"After seeing the scene of the big accident, I panicked.",パニック-panic,,,,,Ch 10 - ニュースで学ぼう！,Sect 03 - 気をつけよう！,X
JLPT_Tango_N3_1129-001,無事＜な＞,無事[ぶじ]＜な＞,"safety, being unharmed",[sound:JLPT_Tango_N3_1129-001.mp3],①　事故にあった人の無事が確認された。,①　事故[じこ]にあった 人[ひと]の 無事[ぶじ]が 確認[かくにん]された。,①　They confirmed the safety of the person who was in the accident.,,,,,,Ch 10 - ニュースで学ぼう！,Sect 03 - 気をつけよう！,X
JLPT_Tango_N3_1129-002,無事＜な＞,無事[ぶじ]＜な＞,"safety, being unharmed",[sound:JLPT_Tango_N3_1129-002.mp3],②　いなくなった男の子が、無事に発見された。,②　いなくなった 男の子[おとこのこ]が、 無事[ぶじ]に 発見[はっけん]された。,②　The missing boy was found unharmed.,,,,,,Ch 10 - ニュースで学ぼう！,Sect 03 - 気をつけよう！,X
JLPT_Tango_N3_1130,防ぐ,防[ふせ]ぐ,"to protect, to defent, to stop",[sound:JLPT_Tango_N3_1130.mp3],警察は、犯罪を防ぐことができなかった。,警察[けいさつ]は、 犯罪[はんざい]を 防[ふせ]ぐことができなかった。,The police could not prevent the crime.,,,,,,Ch 10 - ニュースで学ぼう！,Sect 03 - 気をつけよう！,X
JLPT_Tango_N3_1131,再び,再[ふたた]び,"again, once more",[sound:JLPT_Tango_N3_1131.mp3],ひどい事故が再び起きてしまった。,ひどい 事故[じこ]が 再[ふたた]び 起[お]きてしまった。,A terrible accident has happened again.,,,,,,Ch 10 - ニュースで学ぼう！,Sect 03 - 気をつけよう！,X
