Sort Index,Vocab-Japan,Vocab-Furigana,Vocab-English,audio file,Sent-Japan,Sent-Furigana,Sent-English,Vocab-Pitch,Vocab-POS,Note-Question side,Note-Answer side,Chapter,Section,Gener Sent
JLPT_Tango_N4_0654,水泳,水泳[すいえい],swimming,[sound:JLPT_Tango_N4_0654.mp3],子どものとき、水泳がきらいでした。,子[こ]どものとき、 水泳[すいえい]がきらいでした。,I hated swimming when I was a child.,,,,,Ch 05 - 人と人との関係,Sect 05 - スポーツ,X
JLPT_Tango_N4_0655,野球,野球[やきゅう],baseball,[sound:JLPT_Tango_N4_0655.mp3],野球は日本で人気のスポーツです。,野球[やきゅう]は 日本[にほん]で 人気[にんき]のスポーツです。,Baseball is a popular sport in Japan.,,,,,Ch 05 - 人と人との関係,Sect 05 - スポーツ,X
JLPT_Tango_N4_0655-005,プロ野球,プロ 野球[やきゅう],professional baseball,[sound:JLPT_Tango_N4_0655-005.mp3],,,,,,,Related meaning to 野球,Ch 05 - 人と人との関係,Sect 05 - スポーツ,
JLPT_Tango_N4_0655-006,高校野球,高校[こうこう] 野球[やきゅう],high school baseball,[sound:JLPT_Tango_N4_0655-006.mp3],,,,,,,Related meaning to 野球,Ch 05 - 人と人との関係,Sect 05 - スポーツ,
JLPT_Tango_N4_0656,投げる,投[な]げる,to throw,[sound:JLPT_Tango_N4_0656.mp3],彼が投げるボールはとても速いです。,彼[かれ]が 投[な]げるボールはとても 速[はや]いです。,The balls he throws are really fast.,,,,,Ch 05 - 人と人との関係,Sect 05 - スポーツ,X
JLPT_Tango_N4_0657,スポーツクラブ,スポーツクラブ,sports club,[sound:JLPT_Tango_N4_0657.mp3],うちの近くのスポーツクラブは安くで便利です。,うちの 近[ちか]くのスポーツクラブは 安[やす]くで 便利[べんり]です。,The sports club near my house is inexpensive and convenient.,,,,,Ch 05 - 人と人との関係,Sect 05 - スポーツ,X
JLPT_Tango_N4_0657-005,スポーツジム,スポーツジム,sports gym,[sound:JLPT_Tango_N4_0657-005.mp3],,,,,,,Related meaning to スポーツクラブ,Ch 05 - 人と人との関係,Sect 05 - スポーツ,
JLPT_Tango_N4_0657-100,スポーツ,スポーツ,Sports,[sound:JLPT_Tango_N4_0657-100.mp3],,,,,,,,Ch 05 - 人と人との関係,Sect 06 - スポーツ,
JLPT_Tango_N4_0657-101,クリケット,クリケット,Cricket,[sound:JLPT_Tango_N4_0657-101.mp3],,,,,,,,Ch 05 - 人と人との関係,Sect 06 - スポーツ,
JLPT_Tango_N4_0657-102,バスケットボール,バスケットボール,Basketball,[sound:JLPT_Tango_N4_0657-102.mp3],,,,,,,,Ch 05 - 人と人との関係,Sect 06 - スポーツ,
JLPT_Tango_N4_0657-103,バレーボール,バレーボール,Volleyball,[sound:JLPT_Tango_N4_0657-103.mp3],,,,,,,,Ch 05 - 人と人との関係,Sect 06 - スポーツ,
JLPT_Tango_N4_0657-104,バドミントン,バドミントン,Badminton,[sound:JLPT_Tango_N4_0657-104.mp3],,,,,,,,Ch 05 - 人と人との関係,Sect 06 - スポーツ,
JLPT_Tango_N4_0657-105,ピンポン,ピンポン,Ping Pong,[sound:JLPT_Tango_N4_0657-105.mp3],,,,,,,,Ch 05 - 人と人との関係,Sect 06 - スポーツ,
JLPT_Tango_N4_0657-106,たっきゅう,たっきゅう,Ping Pong,[sound:JLPT_Tango_N4_0657-106.mp3],,,,,,,,Ch 05 - 人と人との関係,Sect 06 - スポーツ,
JLPT_Tango_N4_0657-107,マラソン,マラソン,Marathon,[sound:JLPT_Tango_N4_0657-107.mp3],,,,,,,,Ch 05 - 人と人との関係,Sect 06 - スポーツ,
JLPT_Tango_N4_0657-108,ラグビー,ラグビー,Rugby,[sound:JLPT_Tango_N4_0657-108.mp3],,,,,,,,Ch 05 - 人と人との関係,Sect 06 - スポーツ,
JLPT_Tango_N4_0657-109,水泳,水泳[すいえい],Swimming,[sound:JLPT_Tango_N4_0657-109.mp3],,,,,,,,Ch 05 - 人と人との関係,Sect 06 - スポーツ,
JLPT_Tango_N4_0657-110,スケート,スケート,Skating,[sound:JLPT_Tango_N4_0657-110.mp3],,,,,,,,Ch 05 - 人と人との関係,Sect 06 - スポーツ,
JLPT_Tango_N4_0657-111,スキー,スキー,Skiing,[sound:JLPT_Tango_N4_0657-111.mp3],,,,,,,,Ch 05 - 人と人との関係,Sect 06 - スポーツ,
JLPT_Tango_N4_0658,髪,髪[かみ],hair (on one's head),[sound:JLPT_Tango_N4_0658.mp3],山田さんは髪が長いです。,山田[やまだ]さんは 髪[かみ]が 長[なが]いです。,Yamada-san's hair is long.,,,,,Ch 06 - 健康とようす,Sect 01 - 体・健康,X
JLPT_Tango_N4_0658-005,髪の毛,髪の毛[かみのけ],hair (on one's head),[sound:JLPT_Tango_N4_0658-005.mp3],,,,,,,Same meaning as 髪,Ch 06 - 健康とようす,Sect 01 - 体・健康,
JLPT_Tango_N4_0659,おでこ,おでこ,forehead,[sound:JLPT_Tango_N4_0659.mp3],熱があるとき、おでこを冷やします。,熱[ねつ]があるとき、おでこを 冷[ひ]やします。,"When you have a fever, you should cool your forehead.",,,,,Ch 06 - 健康とようす,Sect 01 - 体・健康,X
JLPT_Tango_N4_0659-005,ひたい,ひたい,forehead,[sound:JLPT_Tango_N4_0659-005.mp3],,,,,,,Same meaning as おでこ,Ch 06 - 健康とようす,Sect 01 - 体・健康,
JLPT_Tango_N4_0660,あご,あご,"chin, jaw",[sound:JLPT_Tango_N4_0660.mp3],ガムをかむのはあごにいいそうです。,ガムをかむのはあごにいいそうです。,I hear that chewing gum is good for your jaw.,,,,,Ch 06 - 健康とようす,Sect 01 - 体・健康,X
JLPT_Tango_N4_0661,ひげ,ひげ,facial hair,[sound:JLPT_Tango_N4_0661.mp3],父は若いとき、ひげがありました。,父[ちち]は 若[わか]いとき、ひげがありました。,My father had facial hair when he was young.,,,,,Ch 06 - 健康とようす,Sect 01 - 体・健康,X
JLPT_Tango_N4_0661-005,あごひげ,あごひげ,beard,[sound:JLPT_Tango_N4_0661-005.mp3],,,,,,,Related meaning to ひげ,Ch 06 - 健康とようす,Sect 01 - 体・健康,
JLPT_Tango_N4_0662,くちびる,くちびる,lip,[sound:JLPT_Tango_N4_0662.mp3],彼女のくちびるはとてもかわいいです。,彼女[かのじょ]のくちびるはとてもかわいいです。,Her lips are really cute.,,,,,Ch 06 - 健康とようす,Sect 01 - 体・健康,X
JLPT_Tango_N4_0663,首,首[くび],neck,[sound:JLPT_Tango_N4_0663.mp3],朝起きたら、首が痛かったです。,朝[あさ] 起[お]きたら、 首[くび]が 痛[いた]かったです。,"When I woke up, my neck hurt.",,,,,Ch 06 - 健康とようす,Sect 01 - 体・健康,X
JLPT_Tango_N4_0664,のど,のど,throat,[sound:JLPT_Tango_N4_0664.mp3],のどにいい薬はありますか。,のどにいい 薬[くすり]はありますか。,Do you have any good medicine for the throat?,,,,,Ch 06 - 健康とようす,Sect 01 - 体・健康,X
JLPT_Tango_N4_0665,肩,肩[かた],shoulder,[sound:JLPT_Tango_N4_0665.mp3],肩が痛いです。,肩[かた]が 痛[いた]いです。,My shoulder hurts.,,,,,Ch 06 - 健康とようす,Sect 01 - 体・健康,X
JLPT_Tango_N4_0666,うで,うで,arm,[sound:JLPT_Tango_N4_0666.mp3],うでを回してください。,うでを 回[まわ]してください。,Please rotate your arms.,,,,,Ch 06 - 健康とようす,Sect 01 - 体・健康,X
JLPT_Tango_N4_0667,ひじ,ひじ,elbow,[sound:JLPT_Tango_N4_0667.mp3],右のひじが赤くなっています。,右[みぎ]のひじが 赤[あか]くなっています。,My right elbow is red.,,,,,Ch 06 - 健康とようす,Sect 01 - 体・健康,X
JLPT_Tango_N4_0668,背中,背中[せなか],back,[sound:JLPT_Tango_N4_0668.mp3],背中をまっすぐにしてください。,背中[せなか]をまっすぐにしてください。,Please straighten your back.,,,,,Ch 06 - 健康とようす,Sect 01 - 体・健康,X
JLPT_Tango_N4_0669,胃,胃[い],stomach,[sound:JLPT_Tango_N4_0669.mp3],ごはんを食べすぎて、胃が痛いです。,ごはんを 食[た]べすぎて、 胃[い]が 痛[いた]いです。,"I ate too much, and now my stomach hurts.",,,,,Ch 06 - 健康とようす,Sect 01 - 体・健康,X
JLPT_Tango_N4_0670,こし,こし,"waist, hip, lower back",[sound:JLPT_Tango_N4_0670.mp3],こしが痛くて、歩けません。,こしが 痛[いた]くて、 歩[ある]けません。,My lower back hurts so much I can't walk.,,,,,Ch 06 - 健康とようす,Sect 01 - 体・健康,X
JLPT_Tango_N4_0671,ひざ,ひざ,knee,[sound:JLPT_Tango_N4_0671.mp3],走ったら、ひざの調子が悪くなりました。,走[はし]ったら、ひざの 調子[ちょうし]が 悪[わる]くなりました。,"After running, my knees got sore.",,,,,Ch 06 - 健康とようす,Sect 01 - 体・健康,X
JLPT_Tango_N4_0672,【お】しり,【お】しり,butt,[sound:JLPT_Tango_N4_0672.mp3],ずっと座っていたので、おしりが痛いです。,ずっと 座[すわ]っていたので、おしりが 痛[いた]いです。,"I was sitting for a while, so my butt hurts.",,,,,Ch 06 - 健康とようす,Sect 01 - 体・健康,X
JLPT_Tango_N4_0673,指,指[ゆび],finger,[sound:JLPT_Tango_N4_0673.mp3],バレーボールで指の骨を折りました。,バレーボールで 指[ゆび]の 骨[ほね]を 折[お]りました。,I broke a bone in my finger playing volley ball.,,,,,Ch 06 - 健康とようす,Sect 01 - 体・健康,X
JLPT_Tango_N4_0673-005,親指,親指[おやゆび],thumb,[sound:JLPT_Tango_N4_0673-005.mp3],,,,,,,Related meaning to 指,Ch 06 - 健康とようす,Sect 01 - 体・健康,
JLPT_Tango_N4_0673-006,人さし指,人さし指[ひとさしゆび],"index finger, pointer finger",[sound:JLPT_Tango_N4_0673-006.mp3],,,,,,,Related meaning to 指,Ch 06 - 健康とようす,Sect 01 - 体・健康,
JLPT_Tango_N4_0673-007,中指,中指[なかゆび],middle finger,[sound:JLPT_Tango_N4_0673-007.mp3],,,,,,,Related meaning to 指,Ch 06 - 健康とようす,Sect 01 - 体・健康,
JLPT_Tango_N4_0673-008,くすり指,くすり 指[ゆび],ring finger,[sound:JLPT_Tango_N4_0673-008.mp3],,,,,,,Related meaning to 指,Ch 06 - 健康とようす,Sect 01 - 体・健康,
JLPT_Tango_N4_0673-009,小指,小指[こゆび],little finger,[sound:JLPT_Tango_N4_0673-009.mp3],,,,,,,Related meaning to 指,Ch 06 - 健康とようす,Sect 01 - 体・健康,
JLPT_Tango_N4_0674,つめ,つめ,nail,[sound:JLPT_Tango_N4_0674.mp3],毎日、つめをきれいにみがきます。,毎日[まいにち]、つめをきれいにみがきます。,I neatly polish my nails every day.,,,,,Ch 06 - 健康とようす,Sect 01 - 体・健康,X
JLPT_Tango_N4_0675,骨,骨[ほね],bone,[sound:JLPT_Tango_N4_0675.mp3],カルシウムは骨にいいそうです。,カルシウムは 骨[ほね]にいいそうです。,I hear calcium is good for the bones.,,,,,Ch 06 - 健康とようす,Sect 01 - 体・健康,X
JLPT_Tango_N4_0676,血,血[ち],blood,[sound:JLPT_Tango_N4_0676.mp3],すべって、足から血が出ました。,すべって、 足[あし]から 血[ち]が 出[で]ました。,I slipped and my foot started bleeding.,,,,,Ch 06 - 健康とようす,Sect 01 - 体・健康,X
JLPT_Tango_N4_0677,力,力[ちから],"strength, power",[sound:JLPT_Tango_N4_0677.mp3],私より妹のほうが力があります。,私[わたし]より 妹[いもうと]のほうが 力[ちから]があります。,My younger sister has more strength than I do.,,,,,Ch 06 - 健康とようす,Sect 01 - 体・健康,X
JLPT_Tango_N4_0677-005,体力,体力[たいりょく],physical strength,[sound:JLPT_Tango_N4_0677-005.mp3],,,,,,,Related meaning to 力,Ch 06 - 健康とようす,Sect 01 - 体・健康,
JLPT_Tango_N4_0678,身長,身長[しんちょう],height,[sound:JLPT_Tango_N4_0678.mp3],１年で身長が１０センチも高くなりました。,１ 年[ねん]で 身長[しんちょう]が １０[じゅっ]センチも 高[たか]くなりました。,My height increased by 10 centimeters in one year.,,,,,Ch 06 - 健康とようす,Sect 01 - 体・健康,X
JLPT_Tango_N4_0679,体重,体重[たいじゅう],weight,[sound:JLPT_Tango_N4_0679.mp3],毎日、体重をチェックしています。,毎日[まいにち]、 体重[たいじゅう]をチェックしています。,I check my weight every day.,,,,,Ch 06 - 健康とようす,Sect 01 - 体・健康,X
JLPT_Tango_N4_0679-005,体重計,体重[たいじゅう] 計[けい],scale,[sound:JLPT_Tango_N4_0679-005.mp3],,,,,,,Related meaning to 体重,Ch 06 - 健康とようす,Sect 01 - 体・健康,
JLPT_Tango_N4_0680,女性,女性[じょせい],woman,[sound:JLPT_Tango_N4_0680.mp3],私が行く病院の先生は女性です。,私[わたし]が 行[い]く 病院[びょういん]の 先生[せんせい]は 女性[じょせい]です。,The doctor at the hospital I go is a woman.,,,,,Ch 06 - 健康とようす,Sect 01 - 体・健康,X
JLPT_Tango_N4_0681,男性,男性[だんせい],man,[sound:JLPT_Tango_N4_0681.mp3],男性のトイレは２階にあります。,男性[だんせい]のトイレは２ 階[かい]にあります。,The men's bathroom is on the second floor.,,,,,Ch 06 - 健康とようす,Sect 01 - 体・健康,X
JLPT_Tango_N4_0682-001,けんこう＜な＞,けんこう＜な＞,health; healthy,[sound:JLPT_Tango_N4_0682-001.mp3],①　けんこうのために野菜を食べています。,①　けんこうのために 野菜[やさい]を 食[た]べています。,①　I'm eating vegetables for my health.,,,,,Ch 06 - 健康とようす,Sect 01 - 体・健康,X
JLPT_Tango_N4_0682-002,けんこう＜な＞,けんこう＜な＞,health; healthy,[sound:JLPT_Tango_N4_0682-002.mp3],②　けんこうな体をつくろう。,②　けんこうな 体[からだ]をつくろう。,②　Let's build a healthy body.,,,,,Ch 06 - 健康とようす,Sect 01 - 体・健康,X
JLPT_Tango_N4_0682-005,けんこう診断,けんこう 診断[しんだん],"health checkup, health examination",[sound:JLPT_Tango_N4_0682-005.mp3],,,,,,,Related meaning to けんこう＜な＞,Ch 06 - 健康とようす,Sect 01 - 体・健康,
JLPT_Tango_N4_0683,じょうぶな,じょうぶな,healthy,[sound:JLPT_Tango_N4_0683.mp3],運動したら、体がじょうぶになりました。,運動[うんどう]したら、 体[からだ]がじょうぶになりました。,"Once I started exercising, my body got more healthy.",,,,,Ch 06 - 健康とようす,Sect 01 - 体・健康,X
JLPT_Tango_N4_0684,ビタミン,ビタミン,vitamin,[sound:JLPT_Tango_N4_0684.mp3],この食事はビタミンが足りません。,この 食事[しょくじ]はビタミンが 足[た]りません。,There aren't enough vitamins in this meal.,,,,,Ch 06 - 健康とようす,Sect 01 - 体・健康,X
JLPT_Tango_N4_0684-005,ビタミンA,ビタミン A[エー],vitamin A,[sound:JLPT_Tango_N4_0684-005.mp3],,,,,,,Related meaning to ビタミン,Ch 06 - 健康とようす,Sect 01 - 体・健康,
JLPT_Tango_N4_0684-006,ビタミンC,ビタミン C[シー],vitamin C,[sound:JLPT_Tango_N4_0684-006.mp3],,,,,,,Related meaning to ビタミン,Ch 06 - 健康とようす,Sect 01 - 体・健康,
JLPT_Tango_N4_0685,太る,太[ふと]る,to gain weight,[sound:JLPT_Tango_N4_0685.mp3],寝る前に食べたので、太ってしまいました。,寝[ね]る 前[まえ]に 食[た]べたので、 太[ふと]ってしまいました。,"I ate before I went to sleep, so I gained weight.",,,,,Ch 06 - 健康とようす,Sect 01 - 体・健康,X
JLPT_Tango_N4_0686,やせる,やせる,to lose weight,[sound:JLPT_Tango_N4_0686.mp3],運動しても、なかなかやせません。,運動[うんどう]しても、なかなかやせません。,I can't lose weight even if I exercise.,,,,,Ch 06 - 健康とようす,Sect 01 - 体・健康,X
JLPT_Tango_N4_0687,ダイエット＜する＞,ダイエット＜する＞,diet,[sound:JLPT_Tango_N4_0687.mp3],むりなダイエットはやめましょう。,むりなダイエットはやめましょう。,Let's not go on any impossible diets.,,,,,Ch 06 - 健康とようす,Sect 01 - 体・健康,X
JLPT_Tango_N4_0688,やめる,やめる,"to stop, to quit",[sound:JLPT_Tango_N4_0688.mp3],父は先月からたばこをやめました。,父[ちち]は 先月[せんげつ]からたばこをやめました。,My father quit smoking last month.,,,,,Ch 06 - 健康とようす,Sect 01 - 体・健康,X
JLPT_Tango_N4_0689,気をつける,気[き]をつける,to be careful,[sound:JLPT_Tango_N4_0689.mp3],けんこうに気をつけましょう。,けんこうに 気[き]をつけましょう。,Take care of your health.,,,,,Ch 06 - 健康とようす,Sect 01 - 体・健康,X
JLPT_Tango_N4_0690,（のどが）かわく,（のどが）かわく,to get thirsty,[sound:JLPT_Tango_N4_0690.mp3],とてものどがかわきました。,とてものどがかわきました。,I'm really thirsty.,,,,,Ch 06 - 健康とようす,Sect 01 - 体・健康,X
JLPT_Tango_N4_0690-005,からから,からから,"dry, parched",[sound:JLPT_Tango_N4_0690-005.mp3],,,,,,,Related meaning to （のどが）かわく,Ch 06 - 健康とようす,Sect 01 - 体・健康,
JLPT_Tango_N4_0691,（おなかが）すく,（おなかが）すく,"to get empty (stomach), to get hungry",[sound:JLPT_Tango_N4_0691.mp3],スポーツをすると、おなかがすきます。,スポーツをすると、おなかがすきます。,"After playing sports, I've gotten hungry.",,,,,Ch 06 - 健康とようす,Sect 01 - 体・健康,X
JLPT_Tango_N4_0691-005,ぺこぺこ,ぺこぺこ,famished,[sound:JLPT_Tango_N4_0691-005.mp3],,,,,,,Related meaning to （おなかが）すく,Ch 06 - 健康とようす,Sect 01 - 体・健康,
JLPT_Tango_N4_0692,インフルエンザ,インフルエンザ,"influenza, the flu",[sound:JLPT_Tango_N4_0692.mp3],インフルエンザで５月間学校を休みました。,インフルエンザで ５月間[いつかかん] 学校[がっこう]を 休[やす]みました。,I've been absent from school for five days due to the flu.,,,,,Ch 06 - 健康とようす,Sect 02 - 病気・怪我,X
JLPT_Tango_N4_0693,かぜをひく,かぜをひく,to catch a cold,[sound:JLPT_Tango_N4_0693.mp3],子どものとき、よくかぜをひきました。,子[こ]どものとき、よくかぜをひきました。,I often caught colds when I was a child.,,,,,Ch 06 - 健康とようす,Sect 02 - 病気・怪我,X
JLPT_Tango_N4_0694,熱,熱[ねつ],fever,[sound:JLPT_Tango_N4_0694.mp3],３９度も熱が出て、学校へ行けません。,３９[さんじゅうく] 度[ど]も 熱[ねつ]が 出[で]て、 学校[がっこう]へ 行[い]けません。,"I have a fever of 39 degrees, so I can't go to school.",,,,,Ch 06 - 健康とようす,Sect 02 - 病気・怪我,X
JLPT_Tango_N4_0695,体温計,体温計[たいおんけい],thermometer,[sound:JLPT_Tango_N4_0695.mp3],体温計で熱をはかります。,体温計[たいおんけい]で 熱[ねつ]をはかります。,I'm going to take my temperature with a thermometer.,,,,,Ch 06 - 健康とようす,Sect 02 - 病気・怪我,X
JLPT_Tango_N4_0696,やけど＜する＞,やけど＜する＞,burn,[sound:JLPT_Tango_N4_0696.mp3],やかんのおゆでやけどしました。,やかんのおゆでやけどしました。,I burned myself with the hot water in the kettle.,,,,,Ch 06 - 健康とようす,Sect 02 - 病気・怪我,X
JLPT_Tango_N4_0697,げか＜する＞,げか＜する＞,injury,[sound:JLPT_Tango_N4_0697.mp3],サッカーでひざにげかをしました。,サッカーでひざにげかをしました。,I injured my knee playing soccer.,,,,,Ch 06 - 健康とようす,Sect 02 - 病気・怪我,X
JLPT_Tango_N4_0698,きず,きず,"wound, cut",[sound:JLPT_Tango_N4_0698.mp3],このきずはすぐよくなるでしょう。,このきずはすぐよくなるでしょう。,I'm sure this wound will get better right away.,,,,,Ch 06 - 健康とようす,Sect 02 - 病気・怪我,X
JLPT_Tango_N4_0699,調子,調子[ちょうし],condition,[sound:JLPT_Tango_N4_0699.mp3],胃の調子が悪かったので、薬を飲みました。,胃[い]の 調子[ちょうし]が 悪[わる]かったので、 薬[くすり]を 飲[の]みました。,"My stomach's condition is a little strange, so I took some medicine.",,,,,Ch 06 - 健康とようす,Sect 02 - 病気・怪我,X
JLPT_Tango_N4_0700,おかしい,おかしい,"strange, funny",[sound:JLPT_Tango_N4_0700.mp3],おなかの調子がおかしいので、学校を休みます。,おなかの 調子[ちょうし]がおかしいので、 学校[がっこう]を 休[やす]みます。,"My stomach's feeling funny, so I'm going to take time off from school.",,,,,Ch 06 - 健康とようす,Sect 02 - 病気・怪我,X
JLPT_Tango_N4_0700-005,（調子が）へんな,（ 調子[ちょうし]が）へんな,"strange, odd (condition)",[sound:JLPT_Tango_N4_0700-005.mp3],,,,,,,Related meaning to おかしい,Ch 06 - 健康とようす,Sect 02 - 病気・怪我,
JLPT_Tango_N4_0701,具合,具合[ぐあい],"condition, status",[sound:JLPT_Tango_N4_0701.mp3],きのうから体の具合がよくないです。,きのうから 体[からだ]の 具合[ぐあい]がよくないです。,My body's been in bad condition since yesterday.,,,,,Ch 06 - 健康とようす,Sect 02 - 病気・怪我,X
JLPT_Tango_N4_0702,気持ちが悪い,気持[きも]ちが 悪[わる]い,"feeling sick, feeling ill",[sound:JLPT_Tango_N4_0702.mp3],お酒を飲みすぎて、気持ちが悪いです。,お 酒[さけ]を 飲[の]みすぎて、 気持[きも]ちが 悪[わる]いです。,"I drank too much alcohol, and now I feel sick.",,,,"Used when there is a feeling of wanting to vomit, and also when seeing something that is unpleasant or disgusting.",Ch 06 - 健康とようす,Sect 02 - 病気・怪我,X
JLPT_Tango_N4_0703-001,倒れる,倒[たお]れる,to collapse; to fall down,[sound:JLPT_Tango_N4_0703-001.mp3],①　地震で家が倒れました。,①　 地震[じしん]で 家[いえ]が 倒[たお]れました。,①　The house collapsed from the earthquake.,,,,①　collapse;,Ch 06 - 健康とようす,Sect 02 - 病気・怪我,X
JLPT_Tango_N4_0703-002,倒れる,倒[たお]れる,to collapse; to fall down,[sound:JLPT_Tango_N4_0703-002.mp3],②　きのうの夜、祖母が倒れました。,②　きのうの 夜[よる]、 祖母[そぼ]が 倒[たお]れました。,②　My grandmother collapsed last night.,,,,"②　to become ill, to collapse due to illness",Ch 06 - 健康とようす,Sect 02 - 病気・怪我,X
JLPT_Tango_N4_0703-005,（~を）倒す,（~を） 倒[たお]す,"to knock over, to knock down",[sound:JLPT_Tango_N4_0703-005.mp3],,,,,,,Related meaning to 倒れる,Ch 06 - 健康とようす,Sect 02 - 病気・怪我,
JLPT_Tango_N4_0704,診る,診[み]る,to examine,[sound:JLPT_Tango_N4_0704.mp3],いつも近所のお医者さんに診てもらいます。,いつも 近所[きんじょ]のお 医者[いしゃ]さんに 診[み]てもらいます。,I always get examined by the doctor in my neighborhood.,,,,,Ch 06 - 健康とようす,Sect 02 - 病気・怪我,X
JLPT_Tango_N4_0704-005,保険証,保険[ほけん] 証[しょう],insurance card,[sound:JLPT_Tango_N4_0704-005.mp3],,,,,,,Related meaning to 診る,Ch 06 - 健康とようす,Sect 02 - 病気・怪我,
JLPT_Tango_N4_0705,（よこに）なる,（よこに）なる,to lie down,[sound:JLPT_Tango_N4_0705.mp3],医者「では、そちらによこになってください。」,医者[いしゃ]「では、そちらによこになってください。」,Doctor: Please lie down over there.,,,,,Ch 06 - 健康とようす,Sect 02 - 病気・怪我,X
JLPT_Tango_N4_0706,ぬる,ぬる,"to apply, to put",[sound:JLPT_Tango_N4_0706.mp3],１日に３回、きずに薬をぬります。,１ 日[にち]に３ 回[かい]、きずに 薬[くすり]をぬります。,Apply this medicine to your wound three times a day.,,,,,Ch 06 - 健康とようす,Sect 02 - 病気・怪我,X
JLPT_Tango_N4_0707,治す,治[なお]す,"to fix, to heal",[sound:JLPT_Tango_N4_0707.mp3],早く寝て、かぜを治してください。,早[はや]く 寝[ね]て、かぜを 治[なお]してください。,Please go to sleep early so your cold can heal.,,,,,Ch 06 - 健康とようす,Sect 02 - 病気・怪我,X
JLPT_Tango_N4_0708,治る,治[なお]る,"to heal, to recover",[sound:JLPT_Tango_N4_0708.mp3],薬を飲んだら、かぜが治りました。,薬[くすり]を 飲[の]んだら、かぜが 治[なお]りました。,"After taking some medicine, I recovered from my cold.",,,,,Ch 06 - 健康とようす,Sect 02 - 病気・怪我,X
JLPT_Tango_N4_0708-005,よくなる,よくなる,to get better,[sound:JLPT_Tango_N4_0708-005.mp3],,,,,,,Related meaning to 治る,Ch 06 - 健康とようす,Sect 02 - 病気・怪我,
JLPT_Tango_N4_0709,入院＜する＞,入院[にゅういん]＜する＞,hospitalization,[sound:JLPT_Tango_N4_0709.mp3],足のけがで入院しました。,足[あし]のけがで 入院[にゅういん]しました。,I was hospitalized due to an injury to my foot.,,,,,Ch 06 - 健康とようす,Sect 02 - 病気・怪我,X
JLPT_Tango_N4_0710,退院＜する＞,退院[たいいん]＜する＞,leaving a hospital,[sound:JLPT_Tango_N4_0710.mp3],病気が治ったので、明日退院します。,病気[びょうき]が 治[なお]ったので、 明日[あした] 退院[たいいん]します。,"I've recovered from my illness, so I'm going to leave the hospital tomorrow.",,,,,Ch 06 - 健康とようす,Sect 02 - 病気・怪我,X
JLPT_Tango_N4_0711,【お】見まい,【お】 見[み]まい,"sick visit, visiting someone in the hospital",[sound:JLPT_Tango_N4_0711.mp3],友だちのお見まいに行きました。,友[とも]だちのお 見[み]まいに 行[い]きました。,I went to visit my friend in the hospital.,,,,,Ch 06 - 健康とようす,Sect 02 - 病気・怪我,X
JLPT_Tango_N4_0712,生きる,生[い]きる,to live,[sound:JLPT_Tango_N4_0712.mp3],１００さいまで生きたいです。,１００[ひゃく]さいまで 生[い]きたいです。,I want to live to 100.,,,,,Ch 06 - 健康とようす,Sect 02 - 病気・怪我,X
