Sort Index,Vocab-Japan,Vocab-Furigana,Vocab-English,audio file,Sent-Japan,Sent-Furigana,Sent-English,Alternate,Vocab-Pitch,Vocab-POS,Note-Question side,Note-Answer side,Chapter,Section,Gener Sent
JLPT_Tango_N3_0695,苦労＜する＞,苦労[くろう]＜する＞,"trouble, hardship",[sound:JLPT_Tango_N3_0695.mp3],仕事を覚えるために、苦労した。,仕事[しごと]を 覚[おぼ]えるために、 苦労[くろう]した。,I worked hard to learn how to do my job.,,,,,,Ch 06 - 仕事,Sect 03 - 上下委関係,X
JLPT_Tango_N3_0696,くたくたな,くたくたな,exhausted,[sound:JLPT_Tango_N3_0696.mp3],毎日仕事が忙しくて、もうくたくただ。,毎日[まいにち] 仕事[しごと]が 忙[いそが]しくて、もうくたくただ。,"I'm busy at work every day, so I'm exhausted.",くたくた,,,,,Ch 06 - 仕事,Sect 03 - 上下委関係,X
JLPT_Tango_N3_0697,ミス＜する＞,ミス＜する＞,mistake,[sound:JLPT_Tango_N3_0697.mp3],ミスは、だれにでもあることだ。,ミスは、だれにでもあることだ。,Everyone makes mistakes.,ミス-mistake,,,,,Ch 06 - 仕事,Sect 03 - 上下委関係,X
JLPT_Tango_N3_0698,報告＜する＞,報告[ほうこく]＜する＞,report,[sound:JLPT_Tango_N3_0698.mp3],もしミスしてしまったら、上司に報告しなさい。,もしミスしてしまったら、 上司[じょうし]に 報告[ほうこく]しなさい。,"If you make a mistake, report it to your boss.",,,,,,Ch 06 - 仕事,Sect 03 - 上下委関係,X
JLPT_Tango_N3_0699,飲み会,飲[の]み 会[かい],drinking party,[sound:JLPT_Tango_N3_0699.mp3],明日、同期の飲み会がある。,明日[あした]、 同期[どうき]の 飲[の]み 会[かい]がある。,"Tomorrow, I have a drinking party with my contemporaries.",,,,,飲み会 has the connotation of being a private gathering.,Ch 06 - 仕事,Sect 03 - 上下委関係,X
JLPT_Tango_N3_0699-005,宴会,宴会[えんかい],banquet,[sound:JLPT_Tango_N3_0699-005.mp3],,,,,,,,related or similar to 飲み会,Ch 06 - 仕事,Sect 03 - 上下委関係,
JLPT_Tango_N3_0700,歓迎会,歓迎[かんげい] 会[かい],welcome party,[sound:JLPT_Tango_N3_0700.mp3],４月と１０月に歓迎会がある。,４月[しがつ]と １０月[じゅうがつ]に 歓迎[かんげい] 会[かい]がある。,We have welcome parties in April and October.,,,,,,Ch 06 - 仕事,Sect 03 - 上下委関係,X
JLPT_Tango_N3_0700-005,歓迎＜する＞,歓迎[かんげい]＜する＞,welcoming,[sound:JLPT_Tango_N3_0700-005.mp3],,,,,,,,related or similar to 歓迎会,Ch 06 - 仕事,Sect 03 - 上下委関係,
JLPT_Tango_N3_0700-006,送別会,送別[そうべつ] 会[かい],farewell party,[sound:JLPT_Tango_N3_0700-006.mp3],,,,送別,,,,opposite meaning of 歓迎会,Ch 06 - 仕事,Sect 03 - 上下委関係,
JLPT_Tango_N3_0701,飲み放題,飲[の]み 放題[ほうだい],all-you-can-drink,[sound:JLPT_Tango_N3_0701.mp3],飲み放題だと、飲みすぎてしまう。,飲[の]み 放題[ほうだい]だと、 飲[の]みすぎてしまう。,"Whenever it's all-you-can-drink, I always drink too much.",,,,,,Ch 06 - 仕事,Sect 03 - 上下委関係,X
JLPT_Tango_N3_0701-005,食べ放題,食[た]べ 放題[ほうだい],all-you-can-eat,[sound:JLPT_Tango_N3_0701-005.mp3],,,,,,,,related or similar to 飲み放題,Ch 06 - 仕事,Sect 03 - 上下委関係,
JLPT_Tango_N3_0702,つぐ,つぐ,to pour,[sound:JLPT_Tango_N3_0702.mp3],乾杯の前に、先輩にビールをおついだ。,乾杯[かんぱい]の 前[まえ]に、 先輩[せんぱい]にビールをおついだ。,"Before having a toast, I poured some beer for my senior.",,,,,,Ch 06 - 仕事,Sect 03 - 上下委関係,X
JLPT_Tango_N3_0703,勤務＜する＞,勤務[きんむ]＜する＞,"work, duty",[sound:JLPT_Tango_N3_0703.mp3],勤務時間は９時から５時だ。,勤務[きんむ] 時間[じかん]は９[く] 時[じ]から５ 時[じ]だ。,Work hours are from 9:00 to 5:00.,,,,,,Ch 06 - 仕事,Sect 04 - どんな仕事？,X
JLPT_Tango_N3_0704,事務,事務[じむ],"business, office work",[sound:JLPT_Tango_N3_0704.mp3],会社に入ったときは、事務をやっていた。,会社[かいしゃ]に 入[はい]ったときは、 事務[じむ]をやっていた。,"When I joined the company, I was doing office work.",,,,,,Ch 06 - 仕事,Sect 04 - どんな仕事？,X
JLPT_Tango_N3_0705,担当＜する＞,担当[たんとう]＜する＞,charge,[sound:JLPT_Tango_N3_0705.mp3],今年から、大きな仕事を担当している。,今年[ことし]から、 大[おお]きな 仕事[しごと]を 担当[たんとう]している。,"Starting this year, I will be in charge of a big project.",,,,,,Ch 06 - 仕事,Sect 04 - どんな仕事？,X
JLPT_Tango_N3_0705-005,担当者,担当[たんとう] 者[しゃ],person in charge,[sound:JLPT_Tango_N3_0705-005.mp3],,,,,,,,related or similar to 担当＜する＞,Ch 06 - 仕事,Sect 04 - どんな仕事？,
JLPT_Tango_N3_0706,営業＜する＞,営業[えいぎょう]＜する＞,sales,[sound:JLPT_Tango_N3_0706.mp3],営業の仕事は、いろいろな人に会えて楽しい。,営業[えいぎょう]の 仕事[しごと]は、いろいろな 人[ひと]に 会[あ]えて 楽[たの]しい。,Working in sales is fun because I get to meet many people.,,,,,,Ch 06 - 仕事,Sect 04 - どんな仕事？,X
JLPT_Tango_N3_0707,経営＜する＞,経営[けいえい]＜する＞,management,[sound:JLPT_Tango_N3_0707.mp3],将来、自分の会社を経営したい。,将来[しょうらい]、 自分[じぶん]の 会社[かいしゃ]を 経営[けいえい]したい。,"In the future, I want to manage my own company.",,,,,,Ch 06 - 仕事,Sect 04 - どんな仕事？,X
JLPT_Tango_N3_0708,広告＜する＞,広告[こうこく]＜する＞,advertising,[sound:JLPT_Tango_N3_0708.mp3],学生時代から広告の仕事に興味があった。,学生[がくせい] 時代[じだい]から 広告[こうこく]の 仕事[しごと]に 興味[きょうみ]があった。,"Since I was a college student, I had been interested in an advertising job.",,,,,,Ch 06 - 仕事,Sect 04 - どんな仕事？,X
JLPT_Tango_N3_0708-005,広告会社,広告[こうこく] 会社[かいしゃ],advertising company,[sound:JLPT_Tango_N3_0708-005.mp3],,,,,,,,related or similar to 広告＜する＞,Ch 06 - 仕事,Sect 04 - どんな仕事？,
JLPT_Tango_N3_0708-006,宣伝＜する＞,宣伝[せんでん]＜する＞,publicity,[sound:JLPT_Tango_N3_0708-006.mp3],,,,,,,,related or similar to 広告＜する＞,Ch 06 - 仕事,Sect 04 - どんな仕事？,
JLPT_Tango_N3_0709,出版＜する＞,出版[しゅっぱん]＜する＞,publishing,[sound:JLPT_Tango_N3_0709.mp3],あの会社は、日本語の本を出版している。,あの 会社[かいしゃ]は、 日本語[にほんご]の 本[ほん]を 出版[しゅっぱん]している。,That company publishes Japanese language books.,,,,,,Ch 06 - 仕事,Sect 04 - どんな仕事？,X
JLPT_Tango_N3_0709-005,出版社,出版[しゅっぱん] 社[しゃ],publishing company,[sound:JLPT_Tango_N3_0709-005.mp3],,,,,,,,related or similar to 出版＜する＞,Ch 06 - 仕事,Sect 04 - どんな仕事？,
JLPT_Tango_N3_0710,制作＜する＞,制作[せいさく]＜する＞,production,[sound:JLPT_Tango_N3_0710.mp3],私は、テレビドラマを制作したいと思っている。,私[わたし]は、テレビドラマを 制作[せいさく]したいと 思[おも]っている。,I think I would like to produce TV dramas.,,,,,,Ch 06 - 仕事,Sect 04 - どんな仕事？,X
JLPT_Tango_N3_0711,通訳＜する＞,通訳[つうやく]＜する＞,interpreting,[sound:JLPT_Tango_N3_0711.mp3],会社でベトナム語の通訳の仕事をしている。,会社[かいしゃ]でベトナム 語[ご]の 通訳[つうやく]の 仕事[しごと]をしている。,I work at my company as a Vietnamese interpreter.,,,,,,Ch 06 - 仕事,Sect 04 - どんな仕事？,X
JLPT_Tango_N3_0711-005,翻訳＜する＞,翻訳[ほんやく]＜する＞,translating,[sound:JLPT_Tango_N3_0711-005.mp3],,,,,,,,related or similar to 通訳＜する＞,Ch 06 - 仕事,Sect 04 - どんな仕事？,
JLPT_Tango_N3_0712,精算＜する＞,精算[せいさん]＜する＞,"settlement, adjustment",[sound:JLPT_Tango_N3_0712.mp3],交通費は１週間以内に精算してください。,交通[こうつう] 費[ひ]は１週間[いっしゅうかん] 以内[いない]に 精算[せいさん]してください。,Please settle your travel expenses within one week.,,,,,,Ch 06 - 仕事,Sect 04 - どんな仕事？,X
JLPT_Tango_N3_0713,（予定を）立てる,（ 予定[よてい]を） 立[た]てる,to make (plans),[sound:JLPT_Tango_N3_0713.mp3],海外出張の予定を立てる。,海外[かいがい] 出張[しゅっちょう]の 予定[よてい]を 立[た]てる。,I'm making plans to go on an overseas business trip.,,,,,,Ch 06 - 仕事,Sect 04 - どんな仕事？,X
JLPT_Tango_N3_0714,長期,長期[ちょうき],"long term, long time period",[sound:JLPT_Tango_N3_0714.mp3],今度の出張は長期の予定だ。,今度[こんど]の 出張[しゅっちょう]は 長期[ちょうき]の 予定[よてい]だ。,My next business trip is going to be long-term.,,,,,,Ch 06 - 仕事,Sect 04 - どんな仕事？,X
JLPT_Tango_N3_0714-005,長期出張,長期[ちょうき] 出張[しゅっちょう],long term business trip,[sound:JLPT_Tango_N3_0714-005.mp3],,,,,,,,related or similar to 長期,Ch 06 - 仕事,Sect 04 - どんな仕事？,
JLPT_Tango_N3_0714-006,短期,短期[たんき],"short term, short time period",[sound:JLPT_Tango_N3_0714-006.mp3],,,,,,,,opposite meaning of 長期,Ch 06 - 仕事,Sect 04 - どんな仕事？,
JLPT_Tango_N3_0715,日程,日程[にってい],schedule,[sound:JLPT_Tango_N3_0715.mp3],仕事が忙しくて、旅行の日程が決められない。,仕事[しごと]が 忙[いそが]しくて、 旅行[りょこう]の 日程[にってい]が 決[き]められない。,"I'm so busy at work, I can't schedule my trip.",,,,,,Ch 06 - 仕事,Sect 04 - どんな仕事？,X
JLPT_Tango_N3_0716-001,ずらす,ずらす,"to shift, to slide, to push back",[sound:JLPT_Tango_N3_0716-001.mp3],①　いすをずらして、掃除する。,①　いすをずらして、 掃除[そうじ]する。,①　I'm going to move the chairs and clean up.,,,,,① to move horizontally 　,Ch 06 - 仕事,Sect 04 - どんな仕事？,X
JLPT_Tango_N3_0716-002,ずらす,ずらす,"to shift, to slide, to push back",[sound:JLPT_Tango_N3_0716-002.mp3],②　会議のスケジュールを３日ずらそう。,②　 会議[かいぎ]のスケジュールを３日[みっか]ずらそう。,②　Let's slide the meeting schedule back three days.,,,,,② to reschedule,Ch 06 - 仕事,Sect 04 - どんな仕事？,X
JLPT_Tango_N3_0716-005,（～が）ずれる,（～が）ずれる,"to be shifted, to slide",[sound:JLPT_Tango_N3_0716-005.mp3],,,,,,,,related or similar to ずらす,Ch 06 - 仕事,Sect 04 - どんな仕事？,
JLPT_Tango_N3_0717,延期＜する＞,延期[えんき]＜する＞,postponement,[sound:JLPT_Tango_N3_0717.mp3],出張が来週に延期された。,出張[しゅっちょう]が 来週[らいしゅう]に 延期[えんき]された。,The business trip was postponed until next week.,,,,,,Ch 06 - 仕事,Sect 04 - どんな仕事？,X
JLPT_Tango_N3_0718,携帯＜する＞,携帯[けいたい]＜する＞,carrying around,[sound:JLPT_Tango_N3_0718.mp3],出張には、必ずパソコンを携帯している。,出張[しゅっちょう]には、 必[かなら]ずパソコンを 携帯[けいたい]している。,I make sure to carry a computer with me during business trips.,,,,,,Ch 06 - 仕事,Sect 04 - どんな仕事？,X
JLPT_Tango_N3_0718-005,携帯電話,携帯[けいたい] 電話[でんわ],cellular phone,[sound:JLPT_Tango_N3_0718-005.mp3],,,,,,,,related or similar to 携帯＜する＞,Ch 06 - 仕事,Sect 04 - どんな仕事？,
JLPT_Tango_N3_0719,協力＜する＞,協力[きょうりょく]＜する＞,cooperation,[sound:JLPT_Tango_N3_0719.mp3],みんなで協力して、いい結果を出そう。,みんなで 協力[きょうりょく]して、いい 結果[けっか]を 出[だ]そう。,Let's all cooperate to achieve the best results.,,,,,,Ch 06 - 仕事,Sect 04 - どんな仕事？,X
JLPT_Tango_N3_0720,省略＜する＞,省略[しょうりゃく]＜する＞,"abbreviation, omission",[sound:JLPT_Tango_N3_0720.mp3],あいさつは省略して、さっそく会議を始めよう。,あいさつは 省略[しょうりゃく]して、さっそく 会議[かいぎ]を 始[はじ]めよう。,Let's do away with the greetings and go ahead and start the meeting.,,,,,,Ch 06 - 仕事,Sect 04 - どんな仕事？,X
JLPT_Tango_N3_0720-005,省く,省[はぶ]く,to omit,[sound:JLPT_Tango_N3_0720-005.mp3],,,,,,,,related or similar to 省略＜する＞,Ch 06 - 仕事,Sect 04 - どんな仕事？,
JLPT_Tango_N3_0721-001,積む,積[つ]む,"to pile up, to stack, to gain (experience)",[sound:JLPT_Tango_N3_0721-001.mp3],①　部長の机の上に、書類が積んである。,①　部長[ぶちょう]の 机[つくえ]の 上[うえ]に、 書類[しょるい]が 積[つ]んである。,①　There are documents piled up on the department chief's desk.,,,,,① to put something on top of something else 　,Ch 06 - 仕事,Sect 04 - どんな仕事？,X
JLPT_Tango_N3_0721-002,積む,積[つ]む,"to pile up, to stack, to gain (experience)",[sound:JLPT_Tango_N3_0721-002.mp3],②　経験を積んで、自分の会社を作りたい。,②　 経験[けいけん]を 積[つ]んで、 自分[じぶん]の 会社[かいしゃ]を 作[つく]りたい。,②　I want to accumulate some experience and start my own company.,,,,,② to happen repeatedly,Ch 06 - 仕事,Sect 04 - どんな仕事？,X
JLPT_Tango_N3_0722,成長＜する＞,成長[せいちょう]＜する＞,to grow,[sound:JLPT_Tango_N3_0722.mp3],大学生のころと比べると、成長したと思う。,大学生[だいがくせい]のころと 比[くら]べると、 成長[せいちょう]したと 思[おも]う。,"Compared to when I was a university student, I think I've grown a lot.",,,,,,Ch 06 - 仕事,Sect 04 - どんな仕事？,X
JLPT_Tango_N3_0723,かせぐ,かせぐ,to earn income,[sound:JLPT_Tango_N3_0723.mp3],お金をかせいで、将来のために貯金したい。,お 金[かね]をかせいで、 将来[しょうらい]のために 貯金[ちょきん]したい。,I want to earn money and save it for my future.,稼ぐ,,,,,Ch 06 - 仕事,Sect 04 - どんな仕事？,X
JLPT_Tango_N3_0724,画面,画面[がめん],screen,[sound:JLPT_Tango_N3_0724.mp3],パソコンの画面を見ていると、目が疲れる。,パソコンの 画面[がめん]を 見[み]ていると、 目[め]が 疲[つか]れる。,Starting at my computer screen wears out my eyes.,,,,,,Ch 06 - 仕事,Sect 05 - パソコンで,X
JLPT_Tango_N3_0725,件名,件名[けんめい],subject (of an e-mail),[sound:JLPT_Tango_N3_0725.mp3],メールの件名は、長すぎないほうがいい。,メールの 件名[けんめい]は、 長[なが]すぎないほうがいい。,It's better if the subject of the e-mail is not too long.,,,,,,Ch 06 - 仕事,Sect 05 - パソコンで,X
JLPT_Tango_N3_0726,受信＜する＞,受信[じゅしん]＜する＞,"receiving, to receive",[sound:JLPT_Tango_N3_0726.mp3],このメールは昨日受信した。,このメールは 昨日[きのう] 受信[じゅしん]した。,I got this e-mail yesterday.,,,,,,Ch 06 - 仕事,Sect 05 - パソコンで,X
JLPT_Tango_N3_0726-005,受信者,受信[じゅしん] 者[しゃ],recipient,[sound:JLPT_Tango_N3_0726-005.mp3],,,,,,,,related or similar to 受信＜する＞,Ch 06 - 仕事,Sect 05 - パソコンで,
JLPT_Tango_N3_0727,送信＜する＞,送信[そうしん]＜する＞,"sending, to send",[sound:JLPT_Tango_N3_0727.mp3],さっき送信したメールは届いただろうか。,さっき 送信[そうしん]したメールは 届[とど]いただろうか。,I wonder if they received the e-mail I sent a while ago.,,,,,,Ch 06 - 仕事,Sect 05 - パソコンで,X
JLPT_Tango_N3_0727-005,送信者,送信[そうしん] 者[しゃ],sender,[sound:JLPT_Tango_N3_0727-005.mp3],,,,,,,,related or similar to 送信＜する＞,Ch 06 - 仕事,Sect 05 - パソコンで,
JLPT_Tango_N3_0728,返信＜する＞,返信[へんしん]＜する＞,"reply, to reply",[sound:JLPT_Tango_N3_0728.mp3],仕事のメールは、できるだけ早く返信しよう。,仕事[しごと]のメールは、できるだけ 早[はや]く 返信[へんしん]しよう。,Let's respond to business e-mails as quickly as possible.,,,,,,Ch 06 - 仕事,Sect 05 - パソコンで,X
JLPT_Tango_N3_0729,やり取り＜する＞,やり 取[と]り＜する＞,to have an exchange,[sound:JLPT_Tango_N3_0729.mp3],毎日のように、メールをやり取りしている。,毎日[まいにち]のように、メールをやり 取[と]りしている。,I exchanged e-mails almost every day.,遣り取り,,,,,Ch 06 - 仕事,Sect 05 - パソコンで,X
JLPT_Tango_N3_0730,入力＜する＞,入力[にゅうりょく]＜する＞,"input, writing",[sound:JLPT_Tango_N3_0730.mp3],大切なメールは、入力したら何回も確認する。,大切[たいせつ]なメールは、 入力[にゅうりょく]したら 何[なん] 回[かい]も 確認[かくにん]する。,"For important e-mails, I check what I write many times.",,,,,,Ch 06 - 仕事,Sect 05 - パソコンで,X
JLPT_Tango_N3_0731,変換,変換＜する＞,conversion,[sound:JLPT_Tango_N3_0731.mp3],彼のメールは漢字の変換ミスがとても多い。,彼[かれ]のメールは 漢字[かんじ]の 変換[へんかん]ミスがとても 多[おお]い。,There are a lot of mis-converted kanji in his e-mails.,,,,,,Ch 06 - 仕事,Sect 05 - パソコンで,X
JLPT_Tango_N3_0732,改行＜する＞,改行[かいぎょう]＜する＞,"new line, new paragraph",[sound:JLPT_Tango_N3_0732.mp3],メールの文は、読みやすいように改行してください。,メールの 文[ぶん]は、 読[よ]みやすいように 改行[かいぎょう]してください。,Please start new lines in your e-mail to make them easy to read.,,,,,,Ch 06 - 仕事,Sect 05 - パソコンで,X
JLPT_Tango_N3_0733,見直す,見直[みなお]す,"to review, to check",[sound:JLPT_Tango_N3_0733.mp3],内容を２回見直して、送信した。,内容[ないよう]を２ 回[かい] 見直[みなお]して、 送信[そうしん]した。,"I rechecked the contents twice, then sent the e-mail.",,,,,,Ch 06 - 仕事,Sect 05 - パソコンで,X
JLPT_Tango_N3_0734,変更＜する＞,変更[へんこう]＜する＞,"change, modification",[sound:JLPT_Tango_N3_0734.mp3],アドレスを変更するのに、時間がかかった。,アドレスを 変更[へんこう]するのに、 時間[じかん]がかかった。,It took time to change the address.,,,,,,Ch 06 - 仕事,Sect 05 - パソコンで,X
JLPT_Tango_N3_0735,画像,画像[がぞう],"image, picture, display",[sound:JLPT_Tango_N3_0735.mp3],このパソコンは画像がとてもきれいだ。,このパソコンは 画像[がぞう]がとてもきれいだ。,The display on this computer is really clear.,,,,,"Generally speaking, 画像 is used for still images, while 映像 is used for moving images.",Ch 06 - 仕事,Sect 05 - パソコンで,X
JLPT_Tango_N3_0735-005,映像,映像[えいぞう],"image, video",[sound:JLPT_Tango_N3_0735-005.mp3],,,,,,,,"related or similar to 画像<div>Generally speaking, 画像 is used for still images, while 映像 is used for moving images.</div>",Ch 06 - 仕事,Sect 05 - パソコンで,
JLPT_Tango_N3_0736,挿入＜する＞,挿入[そうにゅう]＜する＞,insertion,[sound:JLPT_Tango_N3_0736.mp3],画像を挿入して、おもしろいメールを送った。,画像[がぞう]を 挿入[そうにゅう]して、おもしろいメールを 送[おく]った。,I sent an interesting e-mail with an inserted image.,,,,,,Ch 06 - 仕事,Sect 05 - パソコンで,X
JLPT_Tango_N3_0737,添付＜する＞,添付[てんぷ]＜する＞,attachment,[sound:JLPT_Tango_N3_0737.mp3],ファイルを添付して、送信した。,ファイルを 添付[てんぷ]して、 送信[そうしん]した。,I attached a file and sent the e-mail.,,,,,,Ch 06 - 仕事,Sect 05 - パソコンで,X
JLPT_Tango_N3_0737-005,添付ファイル,添付[てんぷ]ファイル,attached file,[sound:JLPT_Tango_N3_0737-005.mp3],,,,,,,,related or similar to 添付＜する＞,Ch 06 - 仕事,Sect 05 - パソコンで,
JLPT_Tango_N3_0738,削除＜する＞,削除[さくじょ]＜する＞,deletion,[sound:JLPT_Tango_N3_0738.mp3],昨日のメールは、削除してください。,昨日[きのう]のメールは、 削除[さくじょ]してください。,Please delete yesterday's e-mail.,,,,,,Ch 06 - 仕事,Sect 05 - パソコンで,X
JLPT_Tango_N3_0739,保存＜する＞,保存[ほぞん]＜する＞,saving,[sound:JLPT_Tango_N3_0739.mp3],好きな写真を何枚か保存した。,好[す]きな 写真[しゃしん]を 何[なん] 枚[まい]か 保存[ほぞん]した。,I saved several of the pictures I liked.,,,,,,Ch 06 - 仕事,Sect 05 - パソコンで,X
JLPT_Tango_N3_0740,新規作成＜する＞,新規[しんき] 作成[さくせい]＜する＞,new file,[sound:JLPT_Tango_N3_0740.mp3],ファイルを新規作成したが、保存し忘れた。,ファイルを 新規[しんき] 作成[さくせい]したが、 保存[ほぞん]し 忘[わす]れた。,"I made a new file, but I forgot to save it.",新規,,,,,Ch 06 - 仕事,Sect 05 - パソコンで,X
JLPT_Tango_N3_0741,完了＜する＞,完了[かんりょう]＜する＞,completion,[sound:JLPT_Tango_N3_0741.mp3],データの送信が完了して、安心した。,データの 送信[そうしん]が 完了[かんりょう]して、 安心[あんしん]した。,I was relieved to have finished sending the data.,,,,,,Ch 06 - 仕事,Sect 05 - パソコンで,X
JLPT_Tango_N3_0742,ブログ,ブログ,blog,[sound:JLPT_Tango_N3_0742.mp3],友だちのブログは、毎日更新されている。,友[とも]だちのブログは、 毎日[まいにち] 更新[こうしん]されている。,My friend's blog is updated every day.,ブログ-blog,,,,,Ch 06 - 仕事,Sect 05 - パソコンで,X
JLPT_Tango_N3_0743,マウス,マウス,mouse,[sound:JLPT_Tango_N3_0743.mp3],パソコンは古いが、マウスは新しい。,パソコンは 古[ふる]いが、マウスは 新[あたら]しい。,"The computer is old, but the mouse is new.",マウス-mouse,,,,,Ch 06 - 仕事,Sect 05 - パソコンで,X
JLPT_Tango_N3_0744,クリック＜する＞,クリック＜する＞,click,[sound:JLPT_Tango_N3_0744.mp3],ここをクリックすると、画面が変わる。,ここをクリックすると、 画面[がめん]が 変[か]わる。,"If you click here, the screen will change.",クリック-click,,,,,Ch 06 - 仕事,Sect 05 - パソコンで,X
JLPT_Tango_N3_0745,プロバイダー,プロバイダー,provider,[sound:JLPT_Tango_N3_0745.mp3],引っ越ししたので、プロバイダーに連絡した。,引っ越[ひっこ]ししたので、プロバイダーに 連絡[れんらく]した。,"I moved, so I contacted the Internet provider.",プロバイダー-provider,,,,,Ch 06 - 仕事,Sect 05 - パソコンで,X
JLPT_Tango_N3_0746,ダウンロード＜する＞,ダウンロード＜する＞,download,[sound:JLPT_Tango_N3_0746.mp3],便利なソフトウェアを、無料でダウンロードした。,便利[べんり]なソフトウェアを、 無料[むりょう]でダウンロードした。,I downloaded some useful software for free.,ダウンロード-download,,,,,Ch 06 - 仕事,Sect 05 - パソコンで,X
JLPT_Tango_N3_0746-005,インストール＜する＞,インストール＜する＞,installation,[sound:JLPT_Tango_N3_0746-005.mp3],,,,インストール-install,,,,related or similar to ダウンロード＜する＞,Ch 06 - 仕事,Sect 05 - パソコンで,
JLPT_Tango_N3_0746-006,アップロード＜する＞,アップロード＜する＞,upload,[sound:JLPT_Tango_N3_0746-006.mp3],,,,アップロード-upload,,,,opposite meaning of ダウンロード＜する＞,Ch 06 - 仕事,Sect 05 - パソコンで,
JLPT_Tango_N3_0747,ノートパソコン,ノートパソコン,"notebook computer, laptop",[sound:JLPT_Tango_N3_0747.mp3],私はこのノートパソコンを、８年も使っている。,私[わたし]はこのノートパソコンを、８ 年[ねん]も 使[つか]っている。,I've been using my notebook computer for eight years now.,,,,,,Ch 06 - 仕事,Sect 05 - パソコンで,X
JLPT_Tango_N3_0747-005,デスクトップ（パソコン）,デスクトップ（パソコン）,desktop computer,[sound:JLPT_Tango_N3_0747-005.mp3],,,,デスクトップ-desktop,,,,related or similar to ノートパソコン,Ch 06 - 仕事,Sect 05 - パソコンで,
JLPT_Tango_N3_0747-101,エンジニア,エンジニア,Engineer,[sound:JLPT_Tango_N3_0747-101.mp3],,,,エンジニア-engineer,,,,,Ch 06 - 仕事,Sect 06 - 職業,
JLPT_Tango_N3_0747-102,デザイナー,デザイナー,Designer,[sound:JLPT_Tango_N3_0747-102.mp3],,,,デザイナー-designer,,,,,Ch 06 - 仕事,Sect 06 - 職業,
JLPT_Tango_N3_0747-103,作家,作家[さっか],Writer,[sound:JLPT_Tango_N3_0747-103.mp3],,,,,,,,,Ch 06 - 仕事,Sect 06 - 職業,
JLPT_Tango_N3_0747-104,画家,画家[がか],Painter,[sound:JLPT_Tango_N3_0747-104.mp3],,,,,,,,,Ch 06 - 仕事,Sect 06 - 職業,
JLPT_Tango_N3_0747-105,政治家,政治家[せいじか],Politician,[sound:JLPT_Tango_N3_0747-105.mp3],,,,,,,,,Ch 06 - 仕事,Sect 06 - 職業,
JLPT_Tango_N3_0747-106,弁護士,弁護士[べんごし],Lawyer,[sound:JLPT_Tango_N3_0747-106.mp3],,,,,,,,,Ch 06 - 仕事,Sect 06 - 職業,
