Sort Index,Vocab-Japan,Vocab-Furigana,Vocab-English,audio file,Sent-Japan,Sent-Furigana,Sent-English,Alternate,Vocab-Pitch,Vocab-POS,Note-Question side,Note-Answer side,Chapter,Section,Gener Sent
JLPT_Tango_N3_0353,送料,送料[そうりょう],"fee, charge",[sound:JLPT_Tango_N3_0353.mp3],荷物を送るとき、送料がかかる。,荷物[にもつ]を 送[おく]るとき、 送料[そうりょう]がかかる。,It costs a fee to send a package.,,,,,,Ch 03 - 毎日の暮らし②,Sect 05 - こんなことも,X
JLPT_Tango_N3_0354,あて先,あて 先[さき],address of recipient,[sound:JLPT_Tango_N3_0354.mp3],あて先を間違えないように書いた。,あて 先[さき]を 間違[まちが]えないように 書[か]いた。,I made sure not to make any mistakes when I wrote the address.,宛て先,,,,,Ch 03 - 毎日の暮らし②,Sect 05 - こんなことも,X
JLPT_Tango_N3_0355,あて名,あて 名[な],name of recipient,[sound:JLPT_Tango_N3_0355.mp3],あて名に母の前を書いた。,あて 名[な]に 母[はは]の 前[まえ]を 書[か]いた。,I wrote my mother's name as the name of the recipient.,宛て名,,,,,Ch 03 - 毎日の暮らし②,Sect 05 - こんなことも,X
JLPT_Tango_N3_0356,差出人,差出人[さしだしにん],sender,[sound:JLPT_Tango_N3_0356.mp3],ここに差出人の住所を書いてください。,ここに 差出人[さしだしにん]の 住所[じゅうしょ]を 書[か]いてください。,Please write the sender's address here.,差し出し,,,,,Ch 03 - 毎日の暮らし②,Sect 05 - こんなことも,X
JLPT_Tango_N3_0357,とりあえず,とりあえず,"first, for the moment, for the time being",[sound:JLPT_Tango_N3_0357.mp3],大学に合格したので、とりあえず母に知らせた。,大学[だいがく]に 合格[ごうかく]したので、とりあえず 母[はは]に 知[し]らせた。,"I got accepted to college, so I first informed my mother.",取り敢えず,,,,,Ch 03 - 毎日の暮らし②,Sect 05 - こんなことも,X
JLPT_Tango_N3_0358,出前,出前[でまえ],home delivery,[sound:JLPT_Tango_N3_0358.mp3],今日は疲れたので、すしの出前にしよう。,今日[きょう]は 疲[つか]れたので、すしの 出前[でまえ]にしよう。,"I'm tired today, so let's order some sushi delivery.",,,,,出前 is used for Japanese delivery foods like sushi and soba.,Ch 03 - 毎日の暮らし②,Sect 05 - こんなことも,X
JLPT_Tango_N3_0358-005,デリバリー,デリバリー,home delivery,[sound:JLPT_Tango_N3_0358-005.mp3],,,,デリバリー-delivery,,,,same meaning as 出前<div>出前 is used for Japanese delivery foods like sushi and soba.</div>,Ch 03 - 毎日の暮らし②,Sect 05 - こんなことも,
JLPT_Tango_N3_0359,ほどく,ほどく,"to unwind, to untie, to unfold",[sound:JLPT_Tango_N3_0359.mp3],玄関で、くつのひもをほどいた。,玄関[げんかん]で、くつのひもをほどいた。,I untied my shoes at the entrance way.,解く,,,,,Ch 03 - 毎日の暮らし②,Sect 05 - こんなことも,X
JLPT_Tango_N3_0359-005,結ぶ,結[むす]ぶ,"to unwind, to untie, to unfold",[sound:JLPT_Tango_N3_0359-005.mp3],,,,,,,,same meaning as ほどく,Ch 03 - 毎日の暮らし②,Sect 05 - こんなことも,
JLPT_Tango_N3_0360,留守番電話,留守番[るすばん] 電話[でんわ],answering machine,[sound:JLPT_Tango_N3_0360.mp3],留守番電話に母の声が入っていた。,留守番[るすばん] 電話[でんわ]に 母[はは]の 声[こえ]が 入[はい]っていた。,My mother's voice was on the answering machine.,,,,,,Ch 03 - 毎日の暮らし②,Sect 05 - こんなことも,X
JLPT_Tango_N3_0361,よく,よく,often,[sound:JLPT_Tango_N3_0361.mp3],両親や兄弟と、よく電話で話している。,両親[りょうしん]や 兄弟[きょうだい]と、よく 電話[でんわ]で 話[はな]している。,I often talk with my parents and siblings on the phone.,,,,,,Ch 03 - 毎日の暮らし②,Sect 05 - こんなことも,X
JLPT_Tango_N3_0362,早め＜な＞,早[はや]め＜な＞,early,[sound:JLPT_Tango_N3_0362.mp3],飛行機のチケットを早めに予約しておく。,飛行機[ひこうき]のチケットを 早[はや]めに 予約[よやく]しておく。,I'm going to reserve my flight tickets early.,,,,,,Ch 03 - 毎日の暮らし②,Sect 05 - こんなことも,X
JLPT_Tango_N3_0362-005,遅め＜な＞,遅[おそ]め＜な＞,"late, slow",[sound:JLPT_Tango_N3_0362-005.mp3],,,,,,,,opposite meaning of 早め＜な＞,Ch 03 - 毎日の暮らし②,Sect 05 - こんなことも,
JLPT_Tango_N3_0363,リサイクル＜する＞,リサイクル＜する＞,recycling,[sound:JLPT_Tango_N3_0363.mp3],洋服を家具もリサイクルできる。,洋服[ようふく]を 家具[かぐ]もリサイクルできる。,You can recycle clothes as well as furniture.,,,,,,Ch 03 - 毎日の暮らし②,Sect 05 - こんなことも,X
JLPT_Tango_N3_0363-005,再利用＜する＞,再[さい] 利用[りよう]＜する＞,recycling,[sound:JLPT_Tango_N3_0363-005.mp3],,,,,,,,same meaning as リサイクル＜する＞,Ch 03 - 毎日の暮らし②,Sect 05 - こんなことも,
JLPT_Tango_N3_0364,どける,どける,to move (out of the way),[sound:JLPT_Tango_N3_0364.mp3],その自転車をどけてください。,その 自転車[じてんしゃ]をどけてください。,Please move that bicycle out of the way.,退ける,,,,,Ch 03 - 毎日の暮らし②,Sect 05 - こんなことも,X
JLPT_Tango_N3_0365,商店街,商店[しょうてん] 街[がい],shopping district,[sound:JLPT_Tango_N3_0365.mp3],駅前に大きな商店街がある。,駅前[えきまえ]に 大[おお]きな 商店[しょうてん] 街[がい]がある。,There is a large shopping district in front of the station.,商店,,,,,Ch 04 - 私たちのまち,Sect 01 - 町の様子,X
JLPT_Tango_N3_0366,にぎやかな,にぎやかな,lively,[sound:JLPT_Tango_N3_0366.mp3],商店街は、たくさんの人でにぎやかだ。,商店[しょうてん] 街[がい]は、たくさんの 人[ひと]でにぎやかだ。,"The shopping district is very lively, and there are a lot of people there.",,,,,,Ch 04 - 私たちのまち,Sect 01 - 町の様子,X
JLPT_Tango_N3_0367,高層ビル,高層[こうそう]ビル,"high rise, skyscraper",[sound:JLPT_Tango_N3_0367.mp3],この町には、高層ビルがない。,この 町[まち]には、 高層[こうそう]ビルがない。,There aren't skyscrapers in this town.,,,,,,Ch 04 - 私たちのまち,Sect 01 - 町の様子,X
JLPT_Tango_N3_0367-005,高層マンション,高層[こうそう]マンション,high-rise apartment building,[sound:JLPT_Tango_N3_0367-005.mp3],,,,,,,,related or similar to 高層ビル,Ch 04 - 私たちのまち,Sect 01 - 町の様子,
JLPT_Tango_N3_0368,建つ,建[た]つ,to be built,[sound:JLPT_Tango_N3_0368.mp3],川の近くに、高層マンションが建った。,川[かわ]の 近[ちか]くに、 高層[こうそう]マンションが 建[た]った。,A high-rise apartment building was built near the river.,,,,,,Ch 04 - 私たちのまち,Sect 01 - 町の様子,X
JLPT_Tango_N3_0368-005,（~を）建てる,（~を） 建[たて]てる,to build,[sound:JLPT_Tango_N3_0368-005.mp3],,,,,,,,related or similar to 建つ,Ch 04 - 私たちのまち,Sect 01 - 町の様子,
JLPT_Tango_N3_0369,水族館,水族館[すいぞくかん],aquarium,[sound:JLPT_Tango_N3_0369.mp3],水族館は、いつも子どもでいっぱいだ。,水族館[すいぞくかん]は、いつも 子[こ]どもでいっぱいだ。,There are always a lot of children at the aquarium.,水族,,,,,Ch 04 - 私たちのまち,Sect 01 - 町の様子,X
JLPT_Tango_N3_0370,博物館,博物館[はくぶつかん],museum,[sound:JLPT_Tango_N3_0370.mp3],週末、博物館はとても込んでいる。,週末[しゅうまつ]、 博物館[はくぶつかん]はとても 込[こ]んでいる。,"On weekends, the museum is very crowded.",,,,,,Ch 04 - 私たちのまち,Sect 01 - 町の様子,X
JLPT_Tango_N3_0371,出入り口（出入口）,出入り口[でいりぐち]（ 出入口[でいりぐち]）,"entrance, exit",[sound:JLPT_Tango_N3_0371.mp3],博物館の出入り口に、ポスターがはってある。,博物館[はくぶつかん]の 出入り口[でいりぐち]に、ポスターがはってある。,There is a poster posted at the entrance of the museum,出入り口,,,,,Ch 04 - 私たちのまち,Sect 01 - 町の様子,X
JLPT_Tango_N3_0372,自動ドア,自動[じどう]ドア,automatic door,[sound:JLPT_Tango_N3_0372.mp3],出入り口に、大きな自動ドアがある。,出入り口[でいりぐち]に、 大[おお]きな 自動[じどう]ドアがある。,There is a large automatic door at the entrance.,,,,,,Ch 04 - 私たちのまち,Sect 01 - 町の様子,X
JLPT_Tango_N3_0373,入館料,入館[にゅうかん] 料[りょう],admission fee,[sound:JLPT_Tango_N3_0373.mp3],入館料は４００円です。,入館[にゅうかん] 料[りょう]は４００[よんひゃく] 円[えん]です。,Admission is 400 yen.,入館,,,,,Ch 04 - 私たちのまち,Sect 01 - 町の様子,X
JLPT_Tango_N3_0374,混雑＜する＞,混雑[こんざつ]＜する＞,being crowded,[sound:JLPT_Tango_N3_0374.mp3],週末は、どこも混雑している。,週末[しゅうまつ]は、どこも 混雑[こんざつ]している。,Everywhere is crowded on weekends.,,,,,,Ch 04 - 私たちのまち,Sect 01 - 町の様子,X
JLPT_Tango_N3_0375,行列,行列[ぎょうれつ],line,[sound:JLPT_Tango_N3_0375.mp3],人気の店の前に、長い行列ができている。,人気[にんき]の 店[みせ]の 前[まえ]に、 長[なが]い 行列[ぎょうれつ]ができている。,There is a long line in front of the popular store.,,,,,,Ch 04 - 私たちのまち,Sect 01 - 町の様子,X
JLPT_Tango_N3_0376,休館日,休館[きゅうかん] 日[び],"holiday, closed day",[sound:JLPT_Tango_N3_0376.mp3],この博物館の休館日は、月曜日だ。,この 博物館[はくぶつかん]の 休館[きゅうかん] 日[び]は、 月曜日[げつようび]だ。,This museum is closed on Mondays.,休館,,,,,Ch 04 - 私たちのまち,Sect 01 - 町の様子,X
JLPT_Tango_N3_0377,ホール,ホール,hall,[sound:JLPT_Tango_N3_0377.mp3],市のホールで、よくコンサートが開かれる。,市[し]のホールで、よくコンサートが 開[ひら]かれる。,Concerts are often held at the city's hall.,ホール-hall,,,,,Ch 04 - 私たちのまち,Sect 01 - 町の様子,X
JLPT_Tango_N3_0378,使用料,使用[しよう] 料[りょう],usage fee,[sound:JLPT_Tango_N3_0378.mp3],このホールの使用料は、３時間１万円だ。,このホールの 使用[しよう] 料[りょう]は、３ 時間[じかん]１ 万[まん] 円[えん]だ。,"It costs 10,000 yen to use this hall for three hours.",,,,,,Ch 04 - 私たちのまち,Sect 01 - 町の様子,X
JLPT_Tango_N3_0379,無料,無料[むりょう],"free, free of charge",[sound:JLPT_Tango_N3_0379.mp3],駅前で無料の化粧品をもらった。,駅前[えきまえ]で 無料[むりょう]の 化粧[けしょう] 品[ひん]をもらった。,I got some free sample cosmetics in front of the station.,,,,,,Ch 04 - 私たちのまち,Sect 01 - 町の様子,X
JLPT_Tango_N3_0379-005,タダ,タダ,"free, free of charge",[sound:JLPT_Tango_N3_0379-005.mp3],,,,,,,,same meaning as 無料<div>(Used primarily in conversation)</div>,Ch 04 - 私たちのまち,Sect 01 - 町の様子,
JLPT_Tango_N3_0379-006,有料,有料[ゆうりょう],"toll, fee",[sound:JLPT_Tango_N3_0379-006.mp3],,,,,,,,opposite meaning of 無料,Ch 04 - 私たちのまち,Sect 01 - 町の様子,
JLPT_Tango_N3_0380,老人ホーム,老人[ろうじん]ホーム,nursing home,[sound:JLPT_Tango_N3_0380.mp3],公園の近くに、老人ホームができるそうだ。,公園[こうえん]の 近[ちか]くに、 老人[ろうじん]ホームができるそうだ。,They say a nursing home is going to be built near the park.,,,,,,Ch 04 - 私たちのまち,Sect 01 - 町の様子,X
JLPT_Tango_N3_0381,目印,目印[めじるし],"landmark, sign",[sound:JLPT_Tango_N3_0381.mp3],A「そちらの近くに、何か目印がありますか。」<div>B「そうですね。赤い橋上あります。」</div>,A「そちらの 近[ちか]くに、 何[なに]か 目印[めじるし]がありますか。」<div>B「そうですね。 赤[あか]い 橋[はし] 上[じょう]あります。」</div>,"A: Are there any landmarks near there?<div>B: Let's see, there's a red bridge.</div>",,,,,,Ch 04 - 私たちのまち,Sect 01 - 町の様子,X
JLPT_Tango_N3_0382,歩道橋,歩道橋[ほどうきょう],pedestrian bridge,[sound:JLPT_Tango_N3_0382.mp3],歩道橋に上ると、町がよく見える。,歩道橋[ほどうきょう]に 上[のぼ]ると、 町[まち]がよく 見[み]える。,"If you go up the pedestrian bridge, you can get a good view of the town.",歩道,,,,,Ch 04 - 私たちのまち,Sect 01 - 町の様子,X
JLPT_Tango_N3_0383,タワー,タワー,tower,[sound:JLPT_Tango_N3_0383.mp3],スカイツリーは、日本で一番高いタワーだ。,スカイツリーは、 日本[にほん]で 一番[いちばん] 高[たか]いタワーだ。,The Tokyo Skytree is the tallest tower in Japan.,タワー-tower,,,,,Ch 04 - 私たちのまち,Sect 01 - 町の様子,X
JLPT_Tango_N3_0383-005,東京スカイツリー,東京[とうきょう]スカイツリー,Tokyo Skytree,[sound:JLPT_Tango_N3_0383-005.mp3],,,,,,,,related or similar to タワー,Ch 04 - 私たちのまち,Sect 01 - 町の様子,
JLPT_Tango_N3_0383-006,東京タワー,東京[とうきょう]タワー,Tokyo Tower,[sound:JLPT_Tango_N3_0383-006.mp3],,,,,,,,related or similar to タワー,Ch 04 - 私たちのまち,Sect 01 - 町の様子,
JLPT_Tango_N3_0384,ライト,ライト,light,[sound:JLPT_Tango_N3_0384.mp3],あのタワーは夜７時になると、ライトがつく。,あのタワーは 夜[よる]７時[しちじ]になると、ライトがつく。,The lights at that tower turn on at 7:00.,ライト-light（光）,,,,,Ch 04 - 私たちのまち,Sect 01 - 町の様子,X
JLPT_Tango_N3_0384-005,ライトアップ,ライトアップ,illumination,[sound:JLPT_Tango_N3_0384-005.mp3],,,,,,,,related or similar to ライト,Ch 04 - 私たちのまち,Sect 01 - 町の様子,
JLPT_Tango_N3_0385,居酒屋,居酒屋[いざかや],Japanese-style pub,[sound:JLPT_Tango_N3_0385.mp3],この町には、たくさん居酒屋がある。,この 町[まち]には、たくさん 居酒屋[いざかや]がある。,There are many Japanese pubs in this town.,,,,,,Ch 04 - 私たちのまち,Sect 01 - 町の様子,X
JLPT_Tango_N3_0386,八百屋,八百屋[やおや],grocery store,[sound:JLPT_Tango_N3_0386.mp3],野菜や果物は八百屋で買う。,野菜[やさい]や 果物[くだもの]は 八百屋[やおや]で 買[か]う。,I buy my fruits and vegetables at the grocery store.,,,,,,Ch 04 - 私たちのまち,Sect 01 - 町の様子,X
JLPT_Tango_N3_0387,正面,正面[しょうめん],front,[sound:JLPT_Tango_N3_0387.mp3],パン屋の正面に、小さいな本屋がある。,パン 屋[や]の 正面[しょうめん]に、 小[ちい]さいな 本屋[ほんや]がある。,There is a small bookstore in front of the bakery.,,,,,,Ch 04 - 私たちのまち,Sect 01 - 町の様子,X
JLPT_Tango_N3_0388,そば,そば,near,[sound:JLPT_Tango_N3_0388.mp3],本屋のそばに、おいしいレストランがある。,本屋[ほんや]のそばに、おいしいレストランがある。,"Near the bookstore, there is a restaurant with delicious food.",,,,,,Ch 04 - 私たちのまち,Sect 01 - 町の様子,X
JLPT_Tango_N3_0389,コンクリート,コンクリート,concrete,[sound:JLPT_Tango_N3_0389.mp3],あのアパートは、コンクリートでできている。,あのアパートは、コンクリートでできている。,That apartment building is made of concrete.,コンクリート-concrete,,,,,Ch 04 - 私たちのまち,Sect 01 - 町の様子,X
JLPT_Tango_N3_0390,地方,地方[ちほう],"region, countryside",[sound:JLPT_Tango_N3_0390.mp3],この地方には、自然がたくさんある。,この 地方[ちほう]には、 自然[しぜん]がたくさんある。,This region is full of nature.,,,,,,Ch 04 - 私たちのまち,Sect 01 - 町の様子,X
JLPT_Tango_N3_0391,地域,地域[ちいき],"area, region",[sound:JLPT_Tango_N3_0391.mp3],この地域には、知り合いがおおい。,この 地域[ちいき]には、 知り合[しりあ]いがおおい。,I have many acquaintances in this area.,,,,,,Ch 04 - 私たちのまち,Sect 01 - 町の様子,X
JLPT_Tango_N3_0392,郊外,郊外[こうがい],suburbs,[sound:JLPT_Tango_N3_0392.mp3],いつか郊外に、庭のある家を建てたい。,いつか 郊外[こうがい]に、 庭[にわ]のある 家[いえ]を 建[た]てたい。,"Someday, I would like to build a house with a garden in the suburbs.",,,,,,Ch 04 - 私たちのまち,Sect 01 - 町の様子,X
JLPT_Tango_N3_0393,中心,中心[ちゅうしん],center,[sound:JLPT_Tango_N3_0393.mp3],広場の中心に、きれいな花が咲いている。,広場[ひろば]の 中心[ちゅうしん]に、きれいな 花[はな]が 咲[さ]いている。,"In the middle of the open area, there are beautiful flowers in bloom.",,,,,,Ch 04 - 私たちのまち,Sect 01 - 町の様子,X
JLPT_Tango_N3_0393-005,中央,中央[ちゅうおう],"center, middle",[sound:JLPT_Tango_N3_0393-005.mp3],,,,,,,,related or similar to 中心,Ch 04 - 私たちのまち,Sect 01 - 町の様子,
JLPT_Tango_N3_0394,移転＜する＞,移転[いてん]＜する＞,"moving, relocating",[sound:JLPT_Tango_N3_0394.mp3],市役所が移転するらしい。,市役所[しやくしょ]が 移転[いてん]するらしい。,It seems the city hall is going to be relocated.,,,,,,Ch 04 - 私たちのまち,Sect 01 - 町の様子,X
JLPT_Tango_N3_0395,工事,工事[こうじ],construction,[sound:JLPT_Tango_N3_0395.mp3],３年くらい前から、駅の工事をしている。,３ 年[ねん]くらい 前[まえ]から、 駅[えき]の 工事[こうじ]をしている。,"Since three years ago, there has been construction on the station going on.",,,,,,Ch 04 - 私たちのまち,Sect 01 - 町の様子,X
JLPT_Tango_N3_0396,空き地,空き地[あきち],vacant land,[sound:JLPT_Tango_N3_0396.mp3],うちの近くの空き地が、駐車場になった。,うちの 近[ちか]くの 空き地[あきち]が、 駐車[ちゅうしゃ] 場[じょう]になった。,The vacant land near my house was made into a parking lot.,,,,,,Ch 04 - 私たちのまち,Sect 01 - 町の様子,X
JLPT_Tango_N3_0397,人ごみ,人[ひと]ごみ,crowd of people,[sound:JLPT_Tango_N3_0397.mp3],人ごみの中を歩くと、ちょっと疲れる。,人[ひと]ごみの 中[なか]を 歩[ある]くと、ちょっと 疲[つか]れる。,It's tiring to walk through large crowds of people.,人込み,,,,,Ch 04 - 私たちのまち,Sect 02 - 町を歩く,X
JLPT_Tango_N3_0398,都会,都会[とかい],"city, urban area",[sound:JLPT_Tango_N3_0398.mp3],都会には自然が少ない。,都会[とかい]には 自然[しぜん]が 少[すく]ない。,There's not much nature in the city.,,,,,,Ch 04 - 私たちのまち,Sect 02 - 町を歩く,X
JLPT_Tango_N3_0399,ぶらぶら＜する＞,ぶらぶら＜する＞,"roaming, wandering",[sound:JLPT_Tango_N3_0399.mp3],休みの日は、一人で町をぶらぶらする。,休[やす]みの 日[ひ]は、一人[ひとり]で 町[まち]をぶらぶらする。,"On my days off, I wander around the town.",,,,,,Ch 04 - 私たちのまち,Sect 02 - 町を歩く,X
JLPT_Tango_N3_0400,うろうろ＜する＞,うろうろ＜する＞,aimlessly wandering,[sound:JLPT_Tango_N3_0400.mp3],最近、知らない人が家の前をうろうろしている。,最近[さいきん]、 知[し]らない 人[ひと]が 家[いえ]の 前[まえ]をうろうろしている。,"Lately, people I don't know have been wandering around in front of my house.",,,,,,Ch 04 - 私たちのまち,Sect 02 - 町を歩く,X
JLPT_Tango_N3_0401,通りかかる,通[とお]りかかる,to happen by,[sound:JLPT_Tango_N3_0401.mp3],通りかかった店に、ちょっと入ってみた。,通[とお]りかかった 店[みせ]に、ちょっと 入[はい]ってみた。,I happened by a store and went in for a bit.,通り掛かる,,,,,Ch 04 - 私たちのまち,Sect 02 - 町を歩く,X
JLPT_Tango_N3_0402,通り過ぎる,通り過[とおりす]ぎる,to pass by,[sound:JLPT_Tango_N3_0402.mp3],スマホを見ていて、学校を通り過ぎてしまった。,スマホを 見[み]ていて、 学校[がっこう]を 通り過[とおりす]ぎてしまった。,I was looking at my smartphone and walked right by the school.,,,,,,Ch 04 - 私たちのまち,Sect 02 - 町を歩く,X
JLPT_Tango_N3_0403,徒歩,徒歩[とほ],walking,[sound:JLPT_Tango_N3_0403.mp3],うちから駅まで、徒歩で１５分くらいだ。,うちから 駅[えき]まで、 徒歩[とほ]で１５ 分[ふん]くらいだ。,It takes about 15 minutes to walk from my house to the station.,,,,,,Ch 04 - 私たちのまち,Sect 02 - 町を歩く,X
JLPT_Tango_N3_0404,方向,方向[ほうこう],"direction, orientation",[sound:JLPT_Tango_N3_0404.mp3],知らない町では、方向がわからない。,知[し]らない 町[まち]では、 方向[ほうこう]がわからない。,I can't get oriented in a town I don't know.,,,,,,Ch 04 - 私たちのまち,Sect 02 - 町を歩く,X
JLPT_Tango_N3_0405,遠回り＜する＞,遠回[とおまわ]り＜する＞,"taking the long way, taking a detour",[sound:JLPT_Tango_N3_0405.mp3],時間があるから、ちょっと遠回りしてみよう。,時間[じかん]があるから、ちょっと 遠回[とおまわ]りしてみよう。,"We have some time, so let's take the scenic way.",,,,,,Ch 04 - 私たちのまち,Sect 02 - 町を歩く,X
JLPT_Tango_N3_0406,近道＜する＞,近道[ちかみち]＜する＞,shortcut,[sound:JLPT_Tango_N3_0406.mp3],駅に行くとき、公園を通って近道した。,駅[えき]に 行[い]くとき、 公園[こうえん]を 通[とお]って 近道[ちかみち]した。,"When I went to the station, I took a shortcut through the park.",,,,,,Ch 04 - 私たちのまち,Sect 02 - 町を歩く,X
JLPT_Tango_N3_0406-005,回り道＜する＞,回り道[まわりみち]＜する＞,"detour, diversion",[sound:JLPT_Tango_N3_0406-005.mp3],,,,,,,,opposite meaning of 近道＜する＞,Ch 04 - 私たちのまち,Sect 02 - 町を歩く,
JLPT_Tango_N3_0407,距離,距離[きょり],distance,[sound:JLPT_Tango_N3_0407.mp3],うちから学校まで、ちょっと距離がある。,うちから 学校[がっこう]まで、ちょっと 距離[きょり]がある。,There's a bit of a distance between my house and school.,,,,,,Ch 04 - 私たちのまち,Sect 02 - 町を歩く,X
JLPT_Tango_N3_0408,追いかける,追[お]いかける,"to chase, to pursue",[sound:JLPT_Tango_N3_0408.mp3],女の子が犬を追いかけている。,女の子[おんなのこ]が 犬[いぬ]を 追[お]いかけている。,A girl is chasing a dog.,追い掛ける,,,,,Ch 04 - 私たちのまち,Sect 02 - 町を歩く,X
JLPT_Tango_N3_0409,追いつく,追[お]いつく,to catch up with,[sound:JLPT_Tango_N3_0409.mp3],ちょっと走ったら、すぐに追いついた。,ちょっと 走[はし]ったら、すぐに 追[お]いついた。,"After running a bit, I caught up right away.",追い付く,,,,,Ch 04 - 私たちのまち,Sect 02 - 町を歩く,X
JLPT_Tango_N3_0410,追い越す,追い越[おいこ]す,"to pass, to surpass",[sound:JLPT_Tango_N3_0410.mp3],前の人がゆっくり歩いていたので、追い越した。,前[まえ]の 人[ひと]がゆっくり 歩[ある]いていたので、 追い越[おいこ]した。,"The person in front of me was walking slowly, so I passed her.",,,,,,Ch 04 - 私たちのまち,Sect 02 - 町を歩く,X
JLPT_Tango_N3_0411,突き当り,突き当[つきあた]り,end of a street,[sound:JLPT_Tango_N3_0411.mp3],この道の突き当りに病院がある。,この 道[みち]の 突き当[つきあた]りに 病院[びょういん]がある。,There is a hospital at the end of this road.,突き当たり,,,,,Ch 04 - 私たちのまち,Sect 02 - 町を歩く,X
JLPT_Tango_N3_0412,立ち止まる,立ち止[たちど]まる,"to stop, to stand still",[sound:JLPT_Tango_N3_0412.mp3],立ち止まらないで、前に進んでください。,立ち止[たちど]まらないで、 前[まえ]に 進[すす]んでください。,Please keep moving without stopping.,,,,,,Ch 04 - 私たちのまち,Sect 02 - 町を歩く,X
JLPT_Tango_N3_0413,横切る,横切[よこぎ]る,"to cross, to go across",[sound:JLPT_Tango_N3_0413.mp3],黒猫が道を横切った。,黒[くろ] 猫[ねこ]が 道[みち]を 横切[よこぎ]った。,A black cat crossed the road.,,,,,,Ch 04 - 私たちのまち,Sect 02 - 町を歩く,X
JLPT_Tango_N3_0414,見かける,見[み]かける,"to notice, to catch sight of",[sound:JLPT_Tango_N3_0414.mp3],駅で知り合いを見かけた。,駅[えき]で 知り合[しりあ]いを 見[み]かけた。,I saw an acquaintance of mine at the station.,見掛ける,,,,,Ch 04 - 私たちのまち,Sect 02 - 町を歩く,X
JLPT_Tango_N3_0415,行き先,行き先[い/ゆきさき],destination,[sound:JLPT_Tango_N3_0415.mp3],急いでいたので、行き先を間違えてしまった。,急[いそ]いでいたので、 行き先[い/ゆきさき]を 間違[まちが]えてしまった。,"I was in a hurry, so I mistook my destination.",,,,,,Ch 04 - 私たちのまち,Sect 03 - 電車と新幹線,X
